Month,Product_Name,Quantity
January2021,Google NYC Campus Sticker,547
January2021,Google Tee Grey,546
January2021,Google Light Pen Green,527
January2021,Google Mural Sticker Sheet,517
January2021,Google Youth FC Zip Hoodie,514
January2021,Google Toddler Hero Tee Black,504
January2021,Google Mountain View Tee Blue,494
January2021,Google Magnet,486
January2021,Google Women's Tech Fleece Vest Charcoal,483
January2021,Google Infant Hero Tee Olive,481
January2021,Android Iconic Sticker Sheet,480
January2021,Google Emoji Sticker Pack,480
January2021,Google NYC Campus Mug,475
January2021,Google Tee F/C Black,470
January2021,Android Pocket Youth Tee Navy,468
January2021,Google Sunnyvale Campus Sticker,459
January2021,Google 24oz Ring Bottle Blue,458
January2021,Google Women's Short Sleeve Hero Dark Grey,452
January2021,Google Pride Sticker,451
January2021,Google KeepCup,448
January2021,Google Pen Grey,438
January2021,YouTube Crew Socks,433
January2021,Google Red Kids Sunglasses,409
January2021,Google NYC Campus Unisex Tee,407
January2021,YouTube Transmission Journal Red,396
January2021,Google Mountain View Campus Zip Hoodie,388
January2021,Android Iconic Notebook,387
January2021,Google Thermal Tumbler Navy,383
January2021,Google Mountain View Campus Sticker,375
January2021,Google Pen Grass Green,370
January2021,Google Striped Penny Pouch,370
January2021,Google Raincoat Navy,355
January2021,Google Infant Charcoal Onesie,352
January2021,Supernatural Paper Backpack,349
January2021,Google NYC Campus Ladies Tee,346
January2021,Google Mountain View Campus Unisex Tee,341
January2021,Google Recycled Writing Set,341
January2021,Google Tee Dark Blue,336
January2021,Google Youth F/C Pullover Hoodie,333
January2021,Google Mens Microfleece Jacket Black,330
January2021,Google Lightweight Crew Sweatshirt Grey,328
January2021,Google NYC Campus Zip Hoodie,316
January2021,Android Iconic Socks,313
January2021,Google PNW Campus Sticker,306
January2021,Supernatural Paper Lunch Sack,295
January2021,Google LA Campus Sticker,292
January2021,YouTube 25 oz Gear Cap Bottle Black,282
January2021,YouTube Play Mug,281
January2021,Google Kids Playful Tee,279
January2021,Google Youth Badge Tee Navy,277
January2021,Maze Pen,274
January2021,YouTube Iconic Play Pin,272
January2021,Google Chicago Campus Zip Hoodie,267
January2021,Google Color Block Tote White,261
January2021,Google Clear Framed Yellow Shades,260
January2021,Google Women's Discovery Lt. Rain Shell,260
January2021,Google Blue Kids Sunglasses,257
January2021,#IamRemarkable Pen,255
January2021,Google Austin Campus Zip Hoodie,247
January2021,Google Mountain View Campus Ladies Tee,245
January2021,Google Keychain,243
January2021,Google Campus Bike Corkbase Mug Blue,241
January2021,Google Boulder Campus Sticker,238
January2021,Google Mural Socks,237
January2021,Google Felt Luggage Tag,236
January2021,Google Stylus Pen w/ LED Light,236
January2021,Android Lumberjack Pin,235
January2021,Google Seattle Campus Sticker,233
January2021,Google Kirkland Campus Sticker,232
January2021,Stan and Friends Onesie Green,228
January2021,Google Cork Card Holder,225
January2021,Google Incognito Zip Pack,225
January2021,Google Cork Pencil Pouch,224
January2021,Google SF Campus Zip Hoodie,224
January2021,Google Tonal Tee Coral,223
January2021,Google Bellevue Campus Sticker,222
January2021,Google Unisex Eco Tee Black,218
January2021,Google Boulder Campus Zip Hoodie,217
January2021,Google Sunnyvale Campus Zip Hoodie,217
January2021,Google Women's Black Tee,212
January2021,Google Sherpa Vest Black,211
January2021,Google Cork Passport Holder,199
January2021,Google Sunnyvale Campus Ladies Tee,199
January2021,Supernatural Paper Tote,199
January2021,Google Chrome Dinosaur Collectible,197
January2021,Google Confetti Pen White,191
January2021,Google Incognito Dopp Kit V2,186
January2021,Google Sunnyvale Campus Unisex Tee,186
January2021,Google Women's Tech Fleece Grey,184
January2021,Google Youth Jumbo Print Tee White,184
January2021,Google Chicago Campus Mug,182
January2021,Google Cork Tablet Case,180
January2021,Google Cork Key Ring,179
January2021,Google LA Campus Zip Hoodie,179
January2021,Google Men's Discovery Lt. Rain Shell,173
January2021,Google Pen Neon Coral,162
January2021,Google Pen Lilac,161
January2021,Google Mural Mug,159
January2021,Google 16 oz Tumbler Blue,157
January2021,Google Clear Framed Gray Shades,155
January2021,Google Seattle Campus Mug,150
January2021,Google PNW Campus Mug,147
January2021,Android Pocket Tee Green,146
January2021,Gift Card- $100.00,144
January2021,Google LA Campus Mug,144
January2021,Google SF Campus Bottle,144
January2021,Google Women's Softshell Moss,143
January2021,Android Pocket Onesie White,136
January2021,Google Tee Mint Green,132
January2021,Android Hipster Pin,130
January2021,Google Austin Campus Mug,130
January2021,Google Frisbee,126
January2021,Google Mini Kick Ball,124
January2021,Google Premium Sunglasses,123
January2021,Android Iconic Pen,119
January2021,Google Tonal Tee Spearmint,118
January2021,Google SF Campus Unisex Tee,117
January2021,Essential Canvas Tote,112
January2021,Google Incognito Laptop Organizer,112
January2021,Google Light Pen Yellow,110
January2021,Daddy Works at Google Book,109
January2021,Android Flex Journal White,103
January2021,Google Women's Kirkland Pullover,102
January2021,Google Confetti Tote White,101
January2021,Android Puzzlebot v2,100
January2021,Google Beekeepers Onesie Pink,100
January2021,Google PNW Campus Unisex Tee,98
January2021,Google Chicago Campus Unisex Tee,97
January2021,Google Mural Notebook,97
January2021,Google Sunnyvale Campus Mug,97
January2021,Google Soft Modal Scarf,95
January2021,Stan and Friends Youth Tee Green,95
January2021,Google PNW Campus Zip Hoodie,94
January2021,Android Geek Pin,92
January2021,Google 24 oz Ring Bottle Red,92
January2021,Google Chicago Campus Bottle,90
January2021,Google Medium Pet Collar (Blue/Green),90
January2021,Google Sustainable Pencil Pouch,90
January2021,Google Sunnyvale Campus Bottle,87
January2021,Google Yellow YoYo,87
January2021,Stan and Friends Toddler Tee Green,87
January2021,Google Clear Framed Blue Shades,85
January2021,Google Boulder Campus Mug,83
January2021,Google SF Campus Ladies Tee,83
January2021,Google Chicago Campus Tote,81
January2021,Google Jumbo Print Tee White,80
January2021,Google Pen Red,79
January2021,Google Austin Campus Unisex Tee,78
January2021,Google Lapel Pin,76
January2021,Google Campus Bike Mini Backpack,75
January2021,Google Kirkland Campus Unisex Tee,74
January2021,Mommy Works at Google Book,73
January2021,Google Kirkland Campus Mug,72
January2021,Google LA Campus Unisex Tee,72
January2021,Google Mural Tote,72
January2021,Womens Google Striped LS,72
January2021,Google Beekeepers Toddler Tee Pink,71
January2021,Google Incognito Flap Pack,71
January2021,Google Sunnyvale Campus Tote,70
January2021,Google Utensil Set,66
January2021,Google Chicago Campus Ladies Tee,65
January2021,Google Seaport Tote,65
January2021,Google Recycled Notebook Set Natural,63
January2021,Google F/C Longsleeve Charcoal,60
January2021,Unisex Google Pocket Tee Grey,58
January2021,Google LA Campus Bottle,57
January2021,#IamRemarkable Lapel Pin,56
January2021,Google Chicago Campus Lapel Pin,56
January2021,Google Austin Campus Ladies Tee,54
January2021,Google SF Campus Tote,53
January2021,Google Austin Campus Tote,52
January2021,Google Cork Journal,52
January2021,Google Emoji Magnet Set,52
January2021,Google Infant Hero Onesie Grey,52
January2021,Google LA Campus Lapel Pin,52
January2021,Android Iconic Backpack,51
January2021,Google Maps Pin,51
January2021,White Google Cloud Tumbler,48
January2021,Google Boulder Campus Unisex Tee,46
January2021,Google PNW Campus Bottle,46
January2021,Android Pocket Toddler Tee White,45
January2021,Google Cambridge Campus Lapel Pin,44
January2021,Google LA Campus Ladies Tee,44
January2021,Google Women's Pride Eco-Tee Black,44
January2021,"Android Iconic 4"" Decal",43
January2021,Google Kirkland Campus Ladies Tee,42
January2021,Google LA Campus Tote,42
January2021,Google Charcoal Unisex Badge Tee,41
January2021,Google Austin Campus Bottle,40
January2021,Google Seattle Campus Unisex Tee,40
January2021,Google Beekeepers Youth Tee Pink,38
January2021,Google Grey Women's Tee,38
January2021,Google Large White Gift Bag 5/PK,38
January2021,Google Medium Pet Leash (Blue/Green),38
January2021,Google Seattle Campus Ladies Tee,37
January2021,Google PNW Campus Lapel Pin,34
January2021,Google PNW Campus Tote,34
January2021,Google Mountain View Tee Red,33
January2021,Google SF Campus Lapel Pin,31
January2021,Google Boulder Campus Bottle,28
January2021,Google Seattle Campus Lapel Pin,27
January2021,Google Totepak,27
January2021,Google Bot,25
January2021,Google Small White Gift Bag 5/PK,25
January2021,Gift Card - $10.00,24
January2021,Gift Card - $25.00,24
January2021,Gift Card - $250.00,24
January2021,Gift Card - $50.00,24
January2021,Google Boulder Campus Ladies Tee,24
January2021,Google Boulder Campus Tote,24
January2021,Google Large Pet Leash (Red/Yellow),24
January2021,Google Austin Campus Lapel Pin,23
January2021,Google Kirkland Campus Lapel Pin,22
January2021,Google Red YoYo,21
January2021,Google Large Pet Collar (Red/Yellow),20
January2021,Android Cardboard Sculpture,18
January2021,Google Boulder Campus Lapel Pin,18
January2021,Google F/C Longsleeve Ash,17
January2021,Google Large Pet Leash (Blue/Green),17
January2021,Google PNW Campus Ladies Tee,17
January2021,Google Medium Pet Leash (Red/Yellow),16
January2021,#IamRemarkable Tote,15
January2021,Google Separating Keyring,13
January2021,Google Summer19 Crew Grey,13
January2021,Google Felt Strap Keyring,12
January2021,Google Large Pet Collar (Blue/Green),12
January2021,Google Blue YoYo,11
January2021,Google Medium Pet Collar (Red/Yellow),11
January2021,Youth Jumbo Print Tee White,7
January2021,Google Tritan Bottle Gray,4
January2021,Google Mountain View Campus Bottle,2
November2020,Google Navy Speckled Tee,3006
November2020,Google Heather Green Speckled Tee,2890
November2020,Google Campus Bike Eco Tee Navy,2317
November2020,Super G Unisex Joggers,2096
November2020,Google F/C Long Sleeve Tee Charcoal,1892
November2020,Google Sherpa Zip Hoodie Charcoal,1830
November2020,Google Zip Hoodie F/C,1756
November2020,Google Sherpa Zip Hoodie Navy,1543
November2020,YouTube Icon Tee Grey,1534
November2020,Google Women's Striped L/S,1431
November2020,Google Tee Yellow,1419
November2020,Google Tee Green,1416
November2020,Google Dino Game Tee,1335
November2020,YouTube Icon Tee Charcoal,1255
November2020,YouTube Women's Favorite Tee White,1220
November2020,Google Badge Heavyweight Pullover Black,1210
November2020,Google Land & Sea French Terry Sweatshirt,1209
November2020,Android Large Removable Sticker Sheet,1179
November2020,Android SM S/F18 Sticker Sheet,1123
November2020,Android Garden Tee Orange,1113
November2020,Android Super Hero 3D Framed Art,1065
November2020,Android Small Trace Journal Black,1012
November2020,Android Large Trace Journal Black,1008
November2020,Android Techie 3D Framed Art,1002
November2020,Google Small Standard Journal Navy,984
November2020,Google Crewneck Sweatshirt Green,970
November2020,Google Pocket Tee Grey,921
November2020,Google Eco Tee Black,898
November2020,Google Land & Sea Cotton Cap,741
November2020,Google Beekeepers Tee Mint,712
November2020,Stan and Friends Tee Green,711
November2020,Google F/C Long Sleeve Tee Ash,692
November2020,Google Land & Sea Unisex Tee,604
November2020,Google Tee Red,585
November2020,Google Tudes Recycled Tee,554
November2020,(not set),536
November2020,Google Land & Sea Nalgene Water Bottle,533
November2020,Google Land & Sea Journal Set,525
November2020,Google Black Tee,521
November2020,Google Land & Sea Mug,465
November2020,Google Blue Stojo Cup,462
November2020,Google Heathered Pom Beanie,459
November2020,Google Land & Sea Women's Eco Tee,455
November2020,Google Land & Sea Tech Taco,440
November2020,Google Land & Sea Tote Bag,439
November2020,Google Utility Bag Grey,434
November2020,Google Tee Blue,431
November2020,Google Leather Strap Hat Black,418
November2020,#IamRemarkable Ladies T-Shirt,417
November2020,Google Men's Puff Jacket Black,411
November2020,Google Women's Grid Zip-Up,405
November2020,Google Women's Microfleece Jacket Black,403
November2020,Google Tee Dark Blue,401
November2020,Google Unisex Pride Eco-Tee Black,391
November2020,Google Tonal Tee Coral,390
November2020,Google Women's Puff Jacket Black,379
November2020,Android Iconic Crewneck Sweatshirt,375
November2020,Flamingo and Friends Tee Blue,375
November2020,Google Laptop Sleeve Charcoal,361
November2020,Mural Food Container,353
November2020,Google Leather Strap Hat Blue,333
November2020,Google Tee Grey,331
November2020,Google Women's Eco Tee Black,320
November2020,Noogler Android Figure,313
November2020,Android Iconic Hat Black,311
November2020,Google Phone Stand Bamboo,310
November2020,YouTube Leather Strap Hat Black,309
November2020,Google Speckled Beanie Navy,301
November2020,Google Crewneck Sweatshirt Navy,281
November2020,Google Tee F/C Black,270
November2020,Candy Cane Android Cardboard Sculpture,267
November2020,Google Toddler FC Tee Charcoal,262
November2020,Google Speckled Beanie Grey,253
November2020,Google See-No Hear-No Set,248
November2020,Google NYC Campus Sticker,246
November2020,Google Campus Bike Bottle,231
November2020,Google LoveHandle Black,229
November2020,Android Iconic Hat Green,228
November2020,Google Jumbo Print Tee White,226
November2020,Google Campus Bike Tote Navy,224
November2020,Android Iconic Pin,216
November2020,Google Toddler FC Zip Hoodie,216
November2020,Google Tech Taco,214
November2020,Google Small Cable Organizer Blue,213
November2020,Android Iconic Hat White,209
November2020,Google Infant Hero Tee Olive,207
November2020,Google Toddler Hero Tee Olive,207
November2020,Keyboard DOT Sticker,207
November2020,Android Iconic Beanie,206
November2020,Google Campus Bike Carry Pouch,206
November2020,Google Toddler Tee White,205
November2020,Google Mouse Pad Navy,200
November2020,Google Cork Base Tumbler,198
November2020,Google Cambridge Campus Sticker,197
November2020,Google Mesh Bag Red,193
November2020,Android Iconic Glass Bottle Green,186
November2020,Google Bottle Cleaner,184
November2020,Google Youth Hero Tee Maroon,184
November2020,Google Large Tote White,183
November2020,Google Tonal Tee Spearmint,183
November2020,Google Youth FC Tee Charcoal,182
November2020,Stainless Bent Straw/Cleaner,180
November2020,#IamRemarkable Water Bottle,178
November2020,Google Mesh Bag Blue,178
November2020,Google Glass Bottle,177
November2020,Google Clear Pen 4-Pack,175
November2020,Snowflake Android Cardboard Sculpture,174
November2020,Google Youth FC Longsleeve Charcoal,173
November2020,Google Woodtop Bottle Black,171
November2020,Android Pocket Onesie Navy,169
November2020,Google Confetti Accessory Pouch,167
November2020,Google Crew Socks,166
November2020,Google Mural Bottle,161
November2020,Google Perk Thermal Tumbler,161
November2020,Google Camp Mug Ivory,160
November2020,Google Cup Cap Tumbler Grey,159
November2020,Google Thermal Tumbler Navy,158
November2020,Google Utility BackPack,157
November2020,Google Jotter Task Pad,154
November2020,Google Youth Hero Tee Grey,153
November2020,Google Flat Front Bag Grey,152
November2020,Google Pen White,152
November2020,Android Iconic Mug Gray,149
November2020,Google Incognito Messenger Bag,148
November2020,Google Cambridge Campus Zip Hoodie,144
November2020,Maze Pen,143
November2020,Google Bear Baby Blanket Beige,134
November2020,Google Cambridge Campus Ladies Tee,133
November2020,Google NYC Campus Mug,132
November2020,Google Crew Striped Athletic Sock,129
November2020,Google Clear Framed Yellow Shades,128
November2020,Android Pocket Onesie White,126
November2020,Google 24oz Ring Bottle Blue,123
November2020,Google Mountain View Campus Sticker,121
November2020,Google Crewneck Sweatshirt Grey,120
November2020,Google Infant Charcoal Onesie,120
November2020,Google Laptop and Cell Phone Stickers,120
November2020,Google Youth Badge Tee Navy,120
November2020,YouTube Crew Socks,119
November2020,Google Color Block Notebook,117
November2020,Google Crew Combed Cotton Sock,117
November2020,Google Sunnyvale Campus Sticker,117
November2020,Google Mini Kick Ball,116
November2020,Google Seattle Campus Sticker,115
November2020,Google Cotopaxi Shell,114
November2020,Google Youth FC Zip Hoodie,112
November2020,Google NYC Campus Bottle,111
November2020,Google PNW Campus Sticker,111
November2020,Google Men's Tech Fleece Grey,110
November2020,Google Cambridge Campus Unisex Tee,107
November2020,Google NYC Campus Lapel Pin,107
November2020,Google Cambridge Campus Tote,106
November2020,Android Pocket Toddler Tee White,105
November2020,Google Bellevue Campus Sticker,105
November2020,Google Kirkland Campus Sticker,105
November2020,Google Pen Citron,105
November2020,Google Cambridge Campus Mug,104
November2020,Google Frisbee,104
November2020,Google Boulder Campus Sticker,103
November2020,Google Cambridge Campus Bottle,103
November2020,Google LA Campus Sticker,103
November2020,Android Jotter Task Pad,102
November2020,Google Split Seam Tee Olive,102
November2020,YouTube Jotter Task Pad,102
November2020,Google Black Cork Journal,101
November2020,Google Decal,101
November2020,Google Sunglasses,100
November2020,Google Mural Socks,99
November2020,Google Metallic Notebook Set,95
November2020,Google Raincoat Navy,93
November2020,Android Buoy Bottle,92
November2020,YouTube Standards Zip Hoodie Black,92
November2020,#IamRemarkable Unisex T-Shirt,90
November2020,YouTube Transmission Journal Red,90
November2020,Google Emoji Sticker Pack,89
November2020,Google Women's Black Tee,89
November2020,Google Men's Tech Fleece Vest Charcoal,85
November2020,Google Large Standard Journal Grey,83
November2020,YouTube Small Sticker Sheet,81
November2020,Google Canteen Bottle Black,80
November2020,Google Infant Hero Onesie Grey,80
November2020,Google Light Pen Blue,80
November2020,Google Light Pen Red,78
November2020,Google Mountain View Tee Blue,78
November2020,Google Recycled Pen Black,76
November2020,Google Sunnyvale Campus Unisex Tee,76
November2020,Google Light Pen Green,74
November2020,Google Super G Tumbler (Blue Lid),74
November2020,#IamRemarkable Unisex Hoodie,72
November2020,Google Super G Tumbler (Red Lid),69
November2020,Google Confetti Slim Task Pad,68
November2020,Google Mural Notebook,68
November2020,Google NYC Campus Unisex Tee,68
November2020,Google Pen Grey,68
November2020,Google Toddler Hero Tee Black,68
November2020,Google Pen Bright Blue,67
November2020,Google Tracking Hat,67
November2020,Google Mountain View Campus Unisex Tee,66
November2020,Google Stylus Pen w/ LED Light,66
November2020,Android Iconic Socks,65
November2020,Google Pen Grass Green,65
November2020,#IamRemarkable Pen,64
November2020,YouTube Twill Sandwich Cap Black,64
November2020,Google Austin Campus Zip Hoodie,63
November2020,Google Men's Softshell Moss,61
November2020,Google NYC Campus Zip Hoodie,61
November2020,Android Pocket Tee Navy,60
November2020,Google Kids Playful Tee,60
November2020,Google Mountain View Campus Ladies Tee,60
November2020,Google Austin Campus Unisex Tee,59
November2020,Google Chicago Campus Zip Hoodie,59
November2020,Android Iconic Sticker Sheet,58
November2020,Google Women's Pride Eco-Tee Black,58
November2020,Google Youth F/C Pullover Hoodie,58
November2020,Google KeepCup,57
November2020,Google Mens Microfleece Jacket Black,56
November2020,Google Mural Sticker Sheet,56
November2020,Google Pride Sticker,56
November2020,Google Youth Badge Tee Olive,56
November2020,#IamRemarkable Journal,55
November2020,Google Confetti Task Pad,54
November2020,Google 16 oz Tumbler Blue,53
November2020,Google Chicago Campus Unisex Tee,53
November2020,YouTube Play Mug,53
November2020,Google Mountain View Campus Zip Hoodie,52
November2020,Google Youth Jumbo Print Tee White,51
November2020,Google F/C Longsleeve Charcoal,50
November2020,Google Lightweight Crew Sweatshirt Grey,50
November2020,Google Sunnyvale Campus Zip Hoodie,50
November2020,Google 24 oz Ring Bottle Red,49
November2020,Google F/C Longsleeve Ash,49
November2020,Google NYC Campus Ladies Tee,49
November2020,Google Tee Mint Green,49
November2020,Android Pocket Toddler Tee Navy,47
November2020,Google Soft Modal Scarf,47
November2020,Google Utensil Set,47
November2020,Android Iconic 4&quot; Decal,45
November2020,Google Austin Campus Ladies Tee,44
November2020,Google Campus Bike,44
November2020,Google Recycled Writing Set,44
November2020,Google Sunnyvale Campus Ladies Tee,43
November2020,Google Keychain,42
November2020,Google Felt Luggage Tag,41
November2020,Google SF Campus Unisex Tee,41
November2020,Google ApPeel Journal Red,40
November2020,Google Women's Tech Fleece Vest Charcoal,40
November2020,Google Chicago Campus Ladies Tee,39
November2020,Google Campus Bike Corkbase Mug Blue,38
November2020,Google Clear Framed Gray Shades,37
November2020,Google Sunnyvale Campus Mug,37
November2020,YouTube Iconic Play Pin,37
November2020,Google Women's Kirkland Pullover,36
November2020,Google Cork Pencil Pouch,35
November2020,Google Lapel Pin,34
November2020,Google Magnet,33
November2020,Google Austin Campus Mug,31
November2020,Google Men's Discovery Lt. Rain Shell,31
November2020,Google Chicago Campus Mug,30
November2020,Google Large White Gift Bag 5/PK,30
November2020,Google SF Campus Zip Hoodie,30
November2020,YouTube 25 oz Gear Cap Bottle Black,30
November2020,Android Pocket Tee Green,28
November2020,Google SF Campus Ladies Tee,28
November2020,Google Sustainable Pencil Pouch,28
November2020,Android Pocket Youth Tee Navy,25
November2020,Essential Canvas Tote,25
November2020,Google Small White Gift Bag 5/PK,25
November2020,Google SF Campus Bottle,24
November2020,Google Seattle Campus Ladies Tee,24
November2020,Google Unisex Eco Tee Black,24
November2020,Google PNW Campus Unisex Tee,23
November2020,Google Striped Penny Pouch,23
November2020,Android Pocket Youth Tee Green,22
November2020,Google Kirkland Campus Ladies Tee,22
November2020,Google Recycled Pen Green,22
November2020,Google Sunnyvale Campus Bottle,22
November2020,Google Boulder Campus Zip Hoodie,21
November2020,Google SF Campus Lapel Pin,21
November2020,Google Women's Discovery Lt. Rain Shell,21
November2020,Stainless Straight Straw/Cleaner,21
November2020,Google Felt Refillable Journal,20
November2020,Google Mountain View Tee Red,19
November2020,Google SF Campus Mug,19
November2020,Google Sherpa Vest Black,19
November2020,Google Women's Tech Fleece Grey,19
November2020,Google Boulder Campus Unisex Tee,18
November2020,Google LA Campus Unisex Tee,18
November2020,Google Packable Bag Black,18
November2020,Google Premium Sunglasses,17
November2020,#IamRemarkable Tote,16
November2020,Google Austin Campus Bottle,16
November2020,Google Beekeepers Youth Tee Pink,16
November2020,Google Camp Mug Gray,16
November2020,Google Cork Card Holder,16
November2020,Google PNW Campus Bottle,16
November2020,Google PNW Campus Mug,16
November2020,Supernatural Paper Lunch Sack,16
November2020,"Android Iconic 4"" Decal",15
November2020,Google Campus Bike Grid Task Pad,15
November2020,Google Incognito Zip Pack,15
November2020,Google Kirkland Campus Unisex Tee,15
November2020,Google Seattle Campus Mug,15
November2020,Google Women's Softshell Moss,15
November2020,Google Bot,13
November2020,Google Boulder Campus Mug,13
November2020,Google Cork Journal,13
November2020,Google Incognito Dopp Kit V2,13
November2020,Google Chicago Campus Bottle,12
November2020,Google Clear Framed Blue Shades,12
November2020,Google Seattle Campus Unisex Tee,12
November2020,Google Sunnyvale Campus Tote,12
November2020,Stan and Friends Onesie Green,12
November2020,Supernatural Paper Tote,12
November2020,Google Austin Campus Tote,11
November2020,Google Blue Kids Sunglasses,11
November2020,Google Boulder Campus Bottle,11
November2020,Google Hemp Tote,11
November2020,Google Incognito Laptop Organizer,11
November2020,Google Incognito Techpack V2,11
November2020,Google Mural Mug,11
November2020,Google Seattle Campus Lapel Pin,11
November2020,Stan and Friends Youth Tee Green,11
November2020,Google Austin Campus Lapel Pin,10
November2020,Google Beekeepers Onesie Pink,10
November2020,Google Beekeepers Toddler Tee Pink,10
November2020,Google Confetti Pen White,10
November2020,Google LA Campus Mug,10
November2020,Google PNW Campus Lapel Pin,10
November2020,Google SF Campus Tote,10
November2020,Android Iconic Pen,9
November2020,Android Lumberjack Pin,9
November2020,Google Cork Key Ring,9
November2020,Google Cork Passport Holder,9
November2020,Google PNW Campus Zip Hoodie,9
November2020,Google Pen Neon Coral,9
November2020,Google Red YoYo,9
November2020,Google Boulder Campus Ladies Tee,8
November2020,Google Chrome Dinosaur Collectible,8
November2020,Stan and Friends Toddler Tee Green,8
November2020,Unisex Google Pocket Tee Grey,8
November2020,Google Chicago Campus Tote,7
November2020,Google Cloth & Pouch Black,7
November2020,Google Emoji Magnet Set,7
November2020,Google Kirkland Campus Mug,7
November2020,Google LA Campus Bottle,7
November2020,Google LA Campus Zip Hoodie,7
November2020,Google PNW Campus Tote,7
November2020,Google Incognito Flap Pack,6
November2020,Google Mountain View Campus Bottle,6
November2020,Google Mountain View Campus Tote,6
November2020,Google Pen Red,6
November2020,Google Recycled Notebook Set Natural,6
November2020,Google Seaport Tote,6
November2020,Womens Google Striped LS,6
November2020,#IamRemarkable Lapel Pin,5
November2020,Google Cork Tablet Case,5
November2020,Google Maps Pin,5
November2020,Google Pen Lilac,5
November2020,Google Red Kids Sunglasses,5
November2020,Google Separating Keyring,5
November2020,Google Totepak,5
November2020,Google Yellow YoYo,5
November2020,Supernatural Paper Backpack,5
November2020,Android Geek Pin,4
November2020,Daddy Works at Google Book,4
