Month,Product_Name,Quantity
December2020,Google Navy Speckled Tee,20574
December2020,Google Zip Hoodie F/C,18470
December2020,Google Crewneck Sweatshirt Navy,17810
December2020,Google F/C Long Sleeve Tee Ash,17551
December2020,Google Badge Heavyweight Pullover Black,17110
December2020,Google Campus Bike Eco Tee Navy,14862
December2020,Google F/C Long Sleeve Tee Charcoal,14658
December2020,Google Men's Tech Fleece Grey,12734
December2020,Super G Unisex Joggers,11609
December2020,Google Crewneck Sweatshirt Green,9725
December2020,Google Eco Tee Black,9184
December2020,Google Women's Striped L/S,7973
December2020,Google Land & Sea Cotton Cap,5897
December2020,Google Heather Green Speckled Tee,5683
December2020,Android SM S/F18 Sticker Sheet,5571
December2020,Google Tee Green,5490
December2020,Google Tee Yellow,5479
December2020,Google Crewneck Sweatshirt Grey,5340
December2020,Android Large Removable Sticker Sheet,5332
December2020,Google Small Standard Journal Navy,5232
December2020,YouTube Crew Socks,5144
December2020,YouTube Women's Favorite Tee White,4980
December2020,Google Leather Strap Hat Blue,4963
December2020,Android Large Trace Journal Black,4755
December2020,Android Garden Tee Orange,4730
December2020,Google Speckled Beanie Navy,4596
December2020,Android Techie 3D Framed Art,4516
December2020,Android Small Trace Journal Black,4494
December2020,Android Super Hero 3D Framed Art,4477
December2020,(not set),4236
December2020,Google Beekeepers Tee Mint,4114
December2020,Stan and Friends Tee Green,4047
December2020,Android Iconic Crewneck Sweatshirt,3980
December2020,YouTube Icon Tee Grey,3846
December2020,Google Crew Socks,3814
December2020,Google Men's Puff Jacket Black,3812
December2020,Google Land & Sea French Terry Sweatshirt,3414
December2020,Google Women's Microfleece Jacket Black,3290
December2020,Google Utility Bag Grey,3068
December2020,Google Women's Grid Zip-Up,3040
December2020,#IamRemarkable Ladies T-Shirt,3011
December2020,Google Sherpa Zip Hoodie Charcoal,2952
December2020,Google Land & Sea Journal Set,2940
December2020,Google Women's Puff Jacket Black,2938
December2020,YouTube Twill Sandwich Cap Black,2901
December2020,Google Heathered Pom Beanie,2862
December2020,YouTube Icon Tee Charcoal,2826
December2020,Google Land & Sea Unisex Tee,2505
December2020,Google Land & Sea Mug,2358
December2020,Google Blue Stojo Cup,2229
December2020,Google Land & Sea Nalgene Water Bottle,2139
December2020,Google Land & Sea Tech Taco,2127
December2020,Google Large Tote White,2077
December2020,Google Laptop Sleeve Charcoal,2051
December2020,Google Mouse Pad Navy,1943
December2020,Google Land & Sea Women's Eco Tee,1942
December2020,Google Flat Front Bag Grey,1936
December2020,Google Glass Bottle,1872
December2020,Android Iconic Mug Gray,1796
December2020,Noogler Android Figure,1796
December2020,Google Unisex Pride Eco-Tee Black,1768
December2020,Google Cork Base Tumbler,1753
December2020,Google Dino Game Tee,1750
December2020,Google Woodtop Bottle Black,1749
December2020,Google Camp Mug Gray,1697
December2020,YouTube Jotter Task Pad,1670
December2020,Google Cup Cap Tumbler Grey,1647
December2020,Google Mural Bottle,1618
December2020,Android Iconic Glass Bottle Green,1616
December2020,#IamRemarkable Water Bottle,1615
December2020,Google Land & Sea Tote Bag,1610
December2020,Google Campus Bike Bottle,1609
December2020,Google Canteen Bottle Black,1594
December2020,Google Bottle Cleaner,1574
December2020,Stainless Bent Straw/Cleaner,1568
December2020,YouTube Leather Strap Hat Black,1539
December2020,Google Tudes Recycled Tee,1517
December2020,Google Speckled Beanie Grey,1503
December2020,Google Pocket Tee Grey,1493
December2020,Flamingo and Friends Tee Blue,1480
December2020,Keyboard DOT Sticker,1464
December2020,Google Metallic Notebook Set,1454
December2020,Google Crew Combed Cotton Sock,1449
December2020,Google Youth FC Tee Charcoal,1449
December2020,Google Youth FC Longsleeve Charcoal,1409
December2020,Google Camp Mug Ivory,1407
December2020,Google Leather Strap Hat Black,1404
December2020,Google Black Tee,1403
December2020,Google NYC Campus Mug,1339
December2020,Google Toddler FC Tee Charcoal,1316
December2020,Android Iconic Hat Green,1281
December2020,Google Pen White,1275
December2020,Google NYC Campus Sticker,1265
December2020,Android Pocket Onesie Navy,1242
December2020,Google Utility BackPack,1239
December2020,Google Youth Badge Tee Navy,1209
December2020,Google See-No Hear-No Set,1208
December2020,Google Tech Taco,1194
December2020,Google LoveHandle Black,1193
December2020,Google Small Cable Organizer Blue,1175
December2020,Android Iconic Hat Black,1171
December2020,Google Bear Baby Blanket Beige,1160
December2020,Google Mesh Bag Blue,1145
December2020,Android Iconic Beanie,1144
December2020,Google Phone Stand Bamboo,1138
December2020,Google Clear Pen 4-Pack,1131
December2020,Google Mesh Bag Red,1130
December2020,Android Iconic Hat White,1120
December2020,Google Toddler Hero Tee Black,1115
December2020,Google Youth Badge Tee Olive,1111
December2020,Google Cambridge Campus Sticker,1107
December2020,Google Infant Hero Tee Olive,1084
December2020,Google Campus Bike Tote Navy,1082
December2020,Google Thermal Tumbler Navy,1079
December2020,Android Iconic Pin,1072
December2020,Google Cambridge Campus Zip Hoodie,1067
December2020,Google Incognito Messenger Bag,1049
December2020,Google Youth Hero Tee Grey,1046
December2020,Google Confetti Accessory Pouch,1029
December2020,Google Tee Blue,1028
December2020,Google Confetti Slim Task Pad,997
December2020,Google Campus Bike Carry Pouch,992
December2020,Android Pocket Toddler Tee Navy,987
December2020,Google Laptop and Cell Phone Stickers,980
December2020,Google NYC Campus Bottle,949
December2020,Android Pocket Tee Navy,904
December2020,Google Cambridge Campus Ladies Tee,903
December2020,Google Cambridge Campus Mug,897
December2020,Google Perk Thermal Tumbler,895
December2020,YouTube Standards Zip Hoodie Black,887
December2020,Google Black Cork Journal,884
December2020,Google Toddler Tee White,884
December2020,Google Tee Red,874
December2020,Google Sherpa Zip Hoodie Navy,866
December2020,Google Cambridge Campus Unisex Tee,865
December2020,Google Cotopaxi Shell,860
December2020,#IamRemarkable Unisex T-Shirt,848
December2020,Google Cambridge Campus Bottle,845
December2020,Google Decal,843
December2020,Google NYC Campus Lapel Pin,843
December2020,Google Cambridge Campus Tote,815
December2020,Google Tee Dark Blue,814
December2020,Google NYC Campus Zip Hoodie,809
December2020,Google Mountain View Campus Unisex Tee,782
December2020,Google Jotter Task Pad,775
December2020,Google Cloth & Pouch Black,766
December2020,Google Tee Grey,760
December2020,Google Large Standard Journal Grey,748
December2020,Google Crew Striped Athletic Sock,746
December2020,Google Cloud Pen,741
December2020,Google Light Pen Blue,735
December2020,Maze Pen,735
December2020,Google Tonal Tee Coral,734
December2020,Google Hemp Tote,701
December2020,Google Men's Tech Fleece Vest Charcoal,698
December2020,YouTube Small Sticker Sheet,697
December2020,Google Aluminum Bottle Red,695
December2020,YouTube Transmission Journal Red,694
December2020,Google Super G Tumbler (Blue Lid),686
December2020,White Google Shoreline Bottle,683
December2020,#IamRemarkable Unisex Hoodie,654
December2020,Google Recycled Pen Black,648
December2020,Google Super G Tumbler (Red Lid),648
December2020,Mural Food Container,623
December2020,Google 24oz Ring Bottle Blue,616
December2020,#IamRemarkable Journal,605
December2020,Android Jotter Task Pad,592
December2020,Google Women's Eco Tee Black,580
December2020,YouTube Iconic Play Pin,566
December2020,Google Split Seam Tee Olive,562
December2020,Google Tee F/C Black,535
December2020,Google Men's Softshell Moss,533
December2020,Google ApPeel Journal Red,525
December2020,Google Campus Bike Grid Task Pad,518
December2020,Google Pen Citron,511
December2020,Google Mural Sticker Sheet,503
December2020,Google Raincoat Navy,490
December2020,YouTube Play Mug,480
December2020,Snowflake Android Cardboard Sculpture,473
December2020,Google Sunglasses,466
December2020,Google Youth Hero Tee Maroon,453
December2020,Google Light Pen Red,452
December2020,Google Emoji Sticker Pack,451
December2020,Google Infant Charcoal Onesie,451
December2020,Google Pen Grey,426
December2020,Google Light Pen Green,419
December2020,Google Women's Tech Fleece Vest Charcoal,415
December2020,Google Recycled Pen Green,406
December2020,Google Pen Bright Blue,405
December2020,Google Mini Kick Ball,401
December2020,Google Mural Socks,396
December2020,YouTube 25 oz Gear Cap Bottle Black,394
December2020,Google Mural Sticky Note Pad,388
December2020,Google LA Campus Sticker,387
December2020,Android Iconic Sticker Sheet,381
December2020,Android Buoy Bottle,380
December2020,Google Pen Grass Green,377
December2020,Google Jumbo Print Tee White,374
December2020,Google Pride Sticker,364
December2020,Google Tonal Tee Spearmint,364
December2020,#IamRemarkable Pen,342
December2020,Google Stylus Pen w/ LED Light,336
December2020,Google Boulder Campus Sticker,335
December2020,Google Sunnyvale Campus Sticker,330
December2020,Google Kids Playful Tee,326
December2020,Google Mountain View Campus Sticker,324
December2020,Android Iconic 4&quot; Decal,323
December2020,Google NYC Campus Unisex Tee,317
December2020,Google Chicago Campus Zip Hoodie,316
December2020,Google Toddler FC Zip Hoodie,305
December2020,Android Iconic Socks,304
December2020,Google Seattle Campus Sticker,302
December2020,Google Austin Campus Zip Hoodie,298
December2020,Google Mountain View Tee Blue,297
December2020,Google PNW Campus Sticker,296
December2020,Google Campus Bike,289
December2020,Google Bellevue Campus Sticker,286
December2020,Google Men's Discovery Lt. Rain Shell,284
December2020,Google Kirkland Campus Sticker,283
December2020,Google Lightweight Crew Sweatshirt Grey,282
December2020,Google Mountain View Campus Zip Hoodie,273
December2020,Google Mens Microfleece Jacket Black,257
December2020,Google Sunnyvale Campus Zip Hoodie,256
December2020,Google Black Cloud Zip Hoodie,253
December2020,Google SF Campus Zip Hoodie,250
December2020,Google Youth F/C Pullover Hoodie,250
December2020,Google Women's Tech Fleece Grey,247
December2020,Google Women's Black Tee,245
December2020,Google Premium Sunglasses,235
December2020,Stan and Friends Onesie Green,235
December2020,Google Mural Mug,228
December2020,Supernatural Paper Backpack,224
December2020,Android Pocket Tee Green,223
December2020,Google NYC Campus Ladies Tee,219
December2020,Google Clear Framed Yellow Shades,218
December2020,Google Red Kids Sunglasses,217
December2020,Google Sunnyvale Campus Ladies Tee,214
December2020,Google Incognito Zip Pack,212
December2020,Google Youth FC Zip Hoodie,208
December2020,Google Sherpa Vest Black,207
December2020,#IamRemarkable Lapel Pin,206
December2020,Google Mountain View Campus Ladies Tee,198
December2020,Google Bot (Multicolored),196
December2020,Google Boulder Campus Zip Hoodie,194
December2020,Google Cork Key Ring,192
December2020,Google Women's Softshell Moss,192
December2020,Google Youth Jumbo Print Tee White,192
December2020,Supernatural Paper Tote,191
December2020,Google Sunnyvale Campus Unisex Tee,188
December2020,Google Campus Bike Corkbase Mug Blue,186
December2020,Android Iconic Pen,184
December2020,Google Blue Kids Sunglasses,183
December2020,Google Austin Campus Unisex Tee,181
December2020,Google Sunnyvale Campus Mug,181
December2020,Google LA Campus Zip Hoodie,177
December2020,Android Pocket Youth Tee Navy,176
December2020,Google SF Campus Unisex Tee,174
December2020,Google Women's Discovery Lt. Rain Shell,173
December2020,Android Pocket Youth Tee Green,169
December2020,Google Cork Pencil Pouch,168
December2020,Google Chicago Campus Unisex Tee,167
December2020,Google Incognito Techpack V2,167
December2020,Google Cork Card Holder,165
December2020,Google 16 oz Tumbler Blue,164
December2020,Google Magnet,164
December2020,Google Austin Campus Mug,162
December2020,Google Austin Campus Ladies Tee,157
December2020,Google Confetti Pen White,156
December2020,Google Large White Gift Bag 5/PK,153
December2020,Google Felt Luggage Tag,149
December2020,Supernatural Paper Lunch Sack,147
December2020,Google Sunnyvale Campus Bottle,144
December2020,Google Chicago Campus Mug,142
December2020,Google PNW Campus Mug,142
December2020,Google F/C Longsleeve Ash,141
December2020,Google SF Campus Bottle,140
December2020,Google KeepCup,138
December2020,Google Clear Framed Blue Shades,135
December2020,Google Pen Lilac,135
December2020,Google Campus Bike Mini Backpack,133
December2020,Google Incognito Flap Pack,132
December2020,Google Cork Tablet Case,131
December2020,Google Packable Bag Black,130
December2020,Google Clear Framed Gray Shades,129
December2020,Google Cork Passport Holder,129
December2020,Google Soft Modal Scarf,129
December2020,Google Kirkland Campus Unisex Tee,128
December2020,Google Striped Penny Pouch,128
December2020,Google Sunnyvale Campus Tote,128
December2020,Google Seattle Campus Mug,127
December2020,Google Women's Kirkland Pullover,123
December2020,Google Chicago Campus Ladies Tee,121
December2020,Google Felt Refillable Journal,118
December2020,Google 24 oz Ring Bottle Red,115
December2020,Google Boulder Campus Unisex Tee,115
December2020,Android Pocket Onesie White,111
December2020,Google Bot,111
December2020,Google Keychain,111
December2020,Google LA Campus Unisex Tee,111
December2020,Daddy Works at Google Book,110
December2020,Google Beekeepers Onesie Pink,109
December2020,Google Cork Journal,108
December2020,Google Recycled Writing Set,108
December2020,Google Seaport Tote,108
December2020,Google Utensil Set,108
December2020,Android Iconic Notebook,106
December2020,Google Tee Mint Green,105
December2020,Google Color Block Notebook,104
December2020,Essential Canvas Tote,103
December2020,Google Confetti Task Pad,101
December2020,Google LA Campus Mug,100
December2020,Google Incognito Dopp Kit V2,97
December2020,Google Pen Red,97
December2020,Google Boulder Campus Mug,96
December2020,Google Toddler Hero Tee Olive,95
December2020,Womens Google Striped LS,95
December2020,Google Women's Pride Eco-Tee Black,94
December2020,Google Lapel Pin,93
December2020,Android Lumberjack Pin,90
December2020,Google SF Campus Lapel Pin,90
December2020,Google PNW Campus Zip Hoodie,89
December2020,Google Incognito Laptop Organizer,81
December2020,Google SF Campus Ladies Tee,81
December2020,Google F/C Longsleeve Charcoal,80
December2020,Google Blue YoYo,78
December2020,Google Sustainable Pencil Pouch,76
December2020,Google Chrome Dino Light Up Water Bottle,75
December2020,Google PNW Campus Unisex Tee,75
December2020,Google Chicago Campus Bottle,73
December2020,Google Austin Campus Bottle,71
December2020,Stan and Friends Youth Tee Green,70
December2020,Google Chrome Dinosaur Collectible,69
December2020,Google Infant Hero Onesie Grey,68
December2020,Google Austin Campus Tote,67
December2020,Google Pen Neon Coral,67
December2020,Stainless Straight Straw/Cleaner,66
December2020,Google Red YoYo,65
December2020,Google Recycled Notebook Set Natural,64
December2020,Google Beekeepers Toddler Tee Pink,62
December2020,Google Boulder Campus Ladies Tee,60
December2020,Google LA Campus Ladies Tee,59
December2020,Google Chicago Campus Tote,56
December2020,Google Seattle Campus Unisex Tee,56
December2020,Google SF Campus Tote,55
December2020,Google Yellow YoYo,55
December2020,Android Pocket Toddler Tee White,53
December2020,Google Boulder Campus Bottle,51
December2020,Unisex Google Pocket Tee Grey,49
December2020,Google Beekeepers Youth Tee Pink,45
December2020,Google Felt Strap Keyring,45
December2020,Mommy Works at Google Book,44
December2020,Google PNW Campus Tote,43
December2020,Google Emoji Magnet Set,41
December2020,Google Mural Notebook,40
December2020,Google Boulder Campus Lapel Pin,38
December2020,Google LA Campus Lapel Pin,38
December2020,Android Puzzlebot v2,37
December2020,Android Iconic Backpack,36
December2020,Google Unisex Eco Tee Black,35
December2020,Google LA Campus Bottle,34
December2020,Google Mural Tote,33
December2020,Google PNW Campus Bottle,33
December2020,Google Seattle Campus Ladies Tee,33
December2020,Google Mountain View Tee Red,32
December2020,Google Large Pet Collar (Blue/Green),30
December2020,Google Small White Gift Bag 5/PK,30
December2020,#IamRemarkable Tote,29
December2020,Google Maps Pin,28
December2020,Stan and Friends Toddler Tee Green,27
December2020,Google Austin Campus Lapel Pin,26
December2020,Google Kirkland Campus Mug,23
December2020,Google Large Pet Leash (Blue/Green),23
December2020,Google Seattle Campus Lapel Pin,22
December2020,Android Hipster Pin,18
December2020,Google Large Pet Collar (Red/Yellow),18
December2020,Google Medium Pet Collar (Blue/Green),18
December2020,Google Summer19 Crew Grey,18
December2020,Google Chicago Campus Lapel Pin,17
December2020,Android Geek Pin,15
December2020,Google Frisbee,15
December2020,Google LA Campus Tote,13
December2020,Google Medium Pet Leash (Blue/Green),13
December2020,Google Totepak,13
December2020,"Android Iconic 4"" Decal",12
December2020,Google Kirkland Campus Ladies Tee,10
December2020,Google Large Pet Leash (Red/Yellow),10
December2020,Google PNW Campus Lapel Pin,10
December2020,Youth Jumbo Print Tee White,10
December2020,Google Medium Pet Leash (Red/Yellow),9
December2020,Google Medium Pet Collar (Red/Yellow),8
December2020,Google PNW Campus Ladies Tee,8
December2020,Google Kirkland Campus Lapel Pin,6
December2020,Google Cambridge Campus Lapel Pin,5
December2020,Google Boulder Campus Tote,4
December2020,BLM Unisex Pullover Hoodie,2
December2020,Gift Card - $50.00,1
January2021,Google Utility BackPack,2343436509
January2021,Google Bot (Multicolored),43639018
January2021,Google F/C Long Sleeve Tee Charcoal,30001161
January2021,Google Knit Blanket,5477886
January2021,Super G Unisex Joggers,111362
January2021,Google Confetti Task Pad,46261
January2021,Google Zip Hoodie F/C,15843
January2021,Android Iconic Crewneck Sweatshirt,15660
January2021,Google Crewneck Sweatshirt Navy,12030
January2021,Google Crewneck Sweatshirt Green,10572
January2021,Google Sherpa Zip Hoodie Charcoal,10550
January2021,YouTube Icon Tee Charcoal,10512
January2021,YouTube Icon Tee Grey,10484
January2021,Google Navy Speckled Tee,9680
January2021,Google Tudes Recycled Tee,9448
January2021,Google Cloud  Unisex Zip Hoodie,9434
January2021,Google Split Seam Tee Olive,8120
January2021,Google Women's Striped L/S,6901
January2021,(not set),6763
January2021,#IamRemarkable Unisex T-Shirt,6590
January2021,Android SM S/F18 Sticker Sheet,5653
January2021,Android Large Removable Sticker Sheet,5383
January2021,Google Small Standard Journal Navy,5291
January2021,Google Men's Puff Jacket Black,5156
January2021,Android Techie 3D Framed Art,5077
January2021,Google Tee Yellow,5007
January2021,Google Eco Tee Black,4708
January2021,Android Super Hero 3D Framed Art,4675
January2021,Android Large Trace Journal Black,4627
January2021,Android Small Trace Journal Black,4527
January2021,Google Badge Heavyweight Pullover Black,4478
January2021,Google Speckled Beanie Navy,3701
January2021,Google Crew Socks,3517
January2021,Google Sherpa Zip Hoodie Navy,3458
January2021,YouTube Women's Favorite Tee White,3440
January2021,Google Tee Green,3219
January2021,Google Utility Bag Grey,3202
January2021,Google Campus Bike Eco Tee Navy,3084
January2021,YouTube Twill Sandwich Cap Black,3081
January2021,Google Beekeepers Tee Mint,3026
January2021,Google Laptop Sleeve Charcoal,3026
January2021,Stan and Friends Tee Green,2986
January2021,Google Cloud Pen,2974
January2021,Google Heather Green Speckled Tee,2914
January2021,Google F/C Long Sleeve Tee Ash,2890
January2021,Google Men's Tech Fleece Vest Charcoal,2869
January2021,Google Pocket Tee Grey,2862
January2021,Google Black Cloud Zip Hoodie,2767
January2021,Google Dino Game Tee,2744
January2021,Google Glass Bottle,2734
January2021,Google Blue Stojo Cup,2733
January2021,Google Land & Sea French Terry Sweatshirt,2732
January2021,Google Land & Sea Cotton Cap,2671
January2021,Noogler Android Figure,2638
January2021,Google Aluminum Bottle Red,2589
January2021,Google Crew Combed Cotton Sock,2462
January2021,Google Men's Softshell Moss,2317
January2021,Google Chrome Dino Light Up Water Bottle,2304
January2021,Google Land & Sea Tech Taco,2291
January2021,Android Garden Tee Orange,2290
January2021,Google Large Tote White,2288
January2021,Google Speckled Beanie Grey,2247
January2021,Google Land & Sea Journal Set,2225
January2021,Google Women's Microfleece Jacket Black,2185
January2021,Google Women's Puff Jacket Black,2176
January2021,Google Phone Stand Bamboo,2071
January2021,Google Shoreline Water Bottle,2067
January2021,Google Cork Base Tumbler,2033
January2021,Google Women's Grid Zip-Up,2008
January2021,Google Campus Bike Bottle,1993
January2021,Google Mural Bottle,1968
January2021,Google Cup Cap Tumbler Grey,1890
January2021,Google Small Cable Organizer Blue,1885
January2021,Android Iconic Glass Bottle Green,1874
January2021,Google Tech Taco,1848
January2021,#IamRemarkable Water Bottle,1841
January2021,#IamRemarkable Unisex Hoodie,1805
January2021,Keyboard DOT Sticker,1782
January2021,Google Land & Sea Mug,1774
January2021,Google Flat Front Bag Grey,1704
January2021,Candy Cane Android Cardboard Sculpture,1661
January2021,Google Pen White,1644
January2021,Google Mouse Pad Navy,1635
January2021,Google Woodtop Bottle Black,1630
January2021,Google Men's Tech Fleece Grey,1611
January2021,Google See-No Hear-No Set,1600
January2021,Google Cotopaxi Shell,1590
January2021,Google Heathered Pom Beanie,1530
January2021,#IamRemarkable Ladies T-Shirt,1514
January2021,Google Campus Bike Tote Navy,1484
January2021,Google Crewneck Sweatshirt Grey,1483
January2021,YouTube Leather Strap Hat Black,1451
January2021,Stainless Bent Straw/Cleaner,1404
January2021,Google Confetti Accessory Pouch,1402
January2021,Google Campus Bike Carry Pouch,1400
January2021,Google Light Pen Blue,1391
January2021,Google Incognito Messenger Bag,1379
January2021,Google Mesh Bag Blue,1375
January2021,YouTube Jotter Task Pad,1324
January2021,Android Iconic Hat Black,1304
January2021,Google Camp Mug Gray,1272
January2021,Google Metallic Notebook Set,1235
January2021,Google Leather Strap Hat Blue,1225
January2021,Google Land & Sea Women's Eco Tee,1223
January2021,Android Iconic Bottle Black,1210
January2021,Google Women's Eco Tee Black,1197
January2021,Google Canteen Bottle Black,1192
January2021,Android Iconic Hat Green,1190
January2021,Google Sunglasses,1187
January2021,Google Youth Badge Tee Olive,1159
January2021,Google Large Standard Journal Grey,1152
January2021,Android Iconic Mug Gray,1120
January2021,Google Crew Striped Athletic Sock,1105
January2021,Android Iconic Hat White,1095
January2021,Google LoveHandle Black,1084
January2021,Google Black Cork Journal,1081
January2021,Android Jotter Task Pad,1080
January2021,Google Bottle Cleaner,1075
January2021,Android Iconic Beanie,1060
January2021,Google Mesh Bag Red,1054
January2021,Google Land & Sea Unisex Tee,1052
January2021,Google Toddler Tee White,1048
January2021,Google Perk Thermal Tumbler,1044
January2021,Google Youth FC Tee Charcoal,1022
January2021,Google Felt Refillable Journal,1003
January2021,Google Cloth & Pouch Black,996
January2021,Flamingo and Friends Tee Blue,981
January2021,Google Laptop and Cell Phone Stickers,980
January2021,Google Light Pen Red,952
January2021,Google Youth Hero Tee Maroon,945
January2021,Google Toddler FC Zip Hoodie,943
January2021,Android Iconic Pin,940
January2021,Google Bear Baby Blanket Beige,926
January2021,Google Youth Hero Tee Grey,911
January2021,White Google Shoreline Bottle,899
January2021,Android Pocket Onesie Navy,898
January2021,Google Jotter Task Pad,879
January2021,Google Cambridge Campus Sticker,878
January2021,Google Cambridge Campus Zip Hoodie,872
January2021,Google Super G Tumbler (Red Lid),851
January2021,Google Toddler FC Tee Charcoal,836
January2021,Stainless Straight Straw/Cleaner,833
January2021,Google Pen Citron,831
January2021,Google Incognito Techpack V2,823
January2021,Google Mural Sticky Note Pad,810
January2021,Google Unisex Pride Eco-Tee Black,803
January2021,#IamRemarkable Journal,794
January2021,Google Clear Pen 4-Pack,784
January2021,Google Campus Bike Grid Task Pad,782
January2021,Google Black Tee,778
January2021,Google Packable Bag Black,776
January2021,Google Leather Strap Hat Black,772
January2021,Google Recycled Pen Black,772
January2021,Google Camp Mug Ivory,771
January2021,Google Youth FC Longsleeve Charcoal,770
January2021,Google NYC Campus Bottle,767
January2021,Google Confetti Slim Task Pad,764
January2021,Google Land & Sea Nalgene Water Bottle,750
January2021,Google Cambridge Campus Mug,746
January2021,Google Twill Cap Charcoal,744
January2021,Snowflake Android Cardboard Sculpture,742
January2021,Android Pocket Toddler Tee Navy,725
January2021,Google Toddler Hero Tee Olive,720
January2021,Google Recycled Pen Green,719
January2021,Google Cambridge Campus Bottle,710
January2021,Android Pocket Youth Tee Green,707
January2021,Google Cambridge Campus Unisex Tee,705
January2021,Google Cambridge Campus Ladies Tee,701
January2021,Google NYC Campus Lapel Pin,695
January2021,YouTube Standards Zip Hoodie Black,693
January2021,Google Cambridge Campus Tote,686
January2021,Google ApPeel Journal Red,677
January2021,Google Decal,677
January2021,Google Color Block Notebook,655
January2021,Android Iconic 4&quot; Decal,642
January2021,Android Buoy Bottle,635
January2021,Google Women's Ringer Tee,623
January2021,Google Pen Bright Blue,621
January2021,Google Tee Blue,610
January2021,Android Pocket Tee Navy,608
January2021,YouTube Small Sticker Sheet,581
January2021,Google Land & Sea Tote Bag,578
January2021,Google Hemp Tote,572
January2021,Google Tee Red,564
January2021,Google Campus Bike,559
January2021,Google Super G Tumbler (Blue Lid),550
