Month,Product_Name,Quantity
November2020,Google Cambridge Campus Lapel Pin,4
November2020,Google Large Pet Collar (Blue/Green),4
November2020,Google Mountain View Campus Mug,4
November2020,Google Mural Sticky Note Pad,4
November2020,Android Iconic Notebook,3
November2020,Android Puzzlebot v2,3
November2020,Gift Card - $50.00,3
November2020,Google Kirkland Campus Lapel Pin,3
November2020,Google Mural Tote,3
November2020,Google Summer19 Crew Grey,3
November2020,Android Iconic Backpack,2
November2020,Google Blue YoYo,2
November2020,Google Campus Bike Mini Backpack,2
November2020,Google Felt Mason Jar,2
November2020,Google LA Campus Ladies Tee,2
November2020,Google Large Pet Collar (Red/Yellow),2
November2020,Google Medium Pet Leash (Blue/Green),2
November2020,Google PNW Campus Ladies Tee,2
November2020,Android Hipster Pin,1
November2020,Gift Card - $10.00,1
November2020,Gift Card - $25.00,1
November2020,Gift Card - $250.00,1
November2020,Google Boulder Campus Lapel Pin,1
November2020,Google Felt Strap Keyring,1
November2020,Google LA Campus Tote,1
November2020,Google Large Pet Leash (Red/Yellow),1
November2020,Google Medium Pet Collar (Blue/Green),1
November2020,Google Tudes Thermal Bottle,1
