port_name,storm_names,average_category
ALBANY,"GLORIA, ELSA, HANNA, SANDY, CONNIE, DAISY, HENRI, ALMA, BERTHA, ALBERTO, DANIELLE, CARRIE, BELLE, BOB, ESTHER, FAY, OPHELIA, BARBARA, ISAIAS, EARL, NOT_NAMED, BERYL, HEIDI, HERMINE, EDNA, DANNY, CINDY, GASTON, EDOUARD, CHARLEY, DONNA, ARTHUR, DAVID, HELENE, AGNES, BRENDA, CAROL, ABLE, FLOYD, IRENE, DIANE, GERDA, DORIA",0.4651
ALEXANDRIA,"GLORIA, HENRI, DAISY, ALEX, BOB, GASTON, CLAUDETTE, CAROL, HALLIE, IRENE, FAY, KATE, AGNES, MICHAEL, CLEO, GLADYS, ANDREW, KYLE, DONNA, EARL, OPHELIA, HOW, ISABEL, DANNY, FLOYD, GABRIELLE, DAVID, DAWN, EDNA, CHARLEY, NOT_NAMED, DIANA, HERMINE, CAMILLE, FRAN, BONNIE, CRISTOBAL, GINGER, BRET, BARBARA, MATTHEW, DEAN, MARIA, ABLE, DENNIS, GUSTAV, ANNA, HUGO, DORIA, SANDY, CINDY, BELLE, DANIELLE, ELSA, FELIX, HELENE, ALMA, ISAIAS, DORIAN, BERTHA, CONNIE, BRENDA, HANNA, ESTHER, ARLENE, ARTHUR, BERYL, GERDA, FREDERIC, IONE, DIANE, ERNESTO, ISBELL, EMILY",0.4973
ANNAPOLIS,"ABLE, AGNES, GASTON, ALEX, GLADYS, CRISTOBAL, HUGO, EMILY, GUSTAV, DAISY, GERDA, ISBELL, DORIA, KATE, ANNA, CARRIE, CINDY, NOT_NAMED, IRENE, BERYL, DANNY, BRENDA, BELLE, SANDY, HANNA, DIANE, ELSA, CAMILLE, ARTHUR, ISAIAS, BERTHA, BOB, CLAUDETTE, ALMA, OPHELIA, ISABEL, GABRIELLE, EARL, DOG, CHARLEY, GINGER, GLORIA, DEAN, DENNIS, CONNIE, JOSE, MATTHEW, DIANA, HELENE, FAY, BRET, CAROL, FELIX, BARBARA, HERMINE, DONNA, BONNIE, JOSEPHINE, ARLENE, KYLE, MARIA, EDNA, ANDREW, DAWN, FREDERIC, DAVID, IONE, ESTHER, MICHAEL, CLEO, ODETTE, HENRI, FLOYD, HOW, DORIAN, DANIELLE, FRAN, HALLIE",0.5202
ATLANTIC CITY,"GABRIELLE, NOT_NAMED, DENNIS, ISABEL, JOSEPHINE, MARIA, FAY, DAISY, BARBARA, DAWN, EDOUARD, BONNIE, DANIELLE, DOG, CLAUDETTE, FLOYD, ARTHUR, DONNA, CINDY, DOLLY, BERYL, OPHELIA, SANDY, HENRI, EMILY, HELENE, ODETTE, BRENDA, IONE, GERDA, GASTON, ALMA, CLEO, ISAIAS, DIANA, ANNA, ESTHER, DAVID, KYLE, BETH, CAROL, BELLE, CARRIE, CONNIE, HERMINE, GLADYS, GUSTAV, LILI, HEIDI, HOW, BILL, CAMILLE, FRAN, BERTHA, ABLE, FELIX, EARL, HANNA, EDNA, IRENE, DEAN, ELSA, ANDREW, DORIA, ALEX, JOSE, ANA, DORIAN, AGNES, HALLIE, DANNY, GLORIA, CRISTOBAL, ARLENE, DIANE, GINNY, CHARLEY, BOB, BRET",0.5861
AUGUSTA,"ELSA, GLADYS, CLEO, BONNIE, LILI, GASTON, HEIDI, HENRI, BARBARA, CINDY, DORIAN, IRENE, DANNY, HERMINE, ALBERTO, BLANCHE, CHARLEY, ARTHUR, KYLE, BRENDA, ALMA, DONNA, BERYL, EDNA, ESTHER, GERDA, DOLLY, ABLE, DIANA, CARRIE, BOB, DIANE, EARL, DORIA, DAISY, BILL, BELLE, NOT_NAMED, AGNES, OPHELIA, HORTENSE, CAROL, JUAN, GINNY, BERTHA, BETH, EDOUARD, GLORIA, FLOYD, KAREN",0.5941
BALTIMORE,"BRET, FRAN, BELLE, GERDA, FAY, FLOYD, DIANE, EARL, ISAIAS, CONNIE, BOB, MARIA, DONNA, CINDY, DIANA, CARRIE, GASTON, CLAUDETTE, ARLENE, SANDY, ALEX, BRENDA, GUSTAV, DENNIS, HENRI, IRENE, DAVID, ANDREW, DAISY, ALMA, KYLE, ESTHER, EMILY, FELIX, FREDERIC, CLEO, HUGO, CAMILLE, DAWN, ISABEL, HERMINE, BONNIE, IONE, CAROL, GLADYS, GLORIA, BARBARA, CRISTOBAL, DORIAN, OPHELIA, ARTHUR, DANNY, GABRIELLE, HANNA, HOW, BERYL, DEAN, HALLIE, CHARLEY, HELENE, DORIA, DOG, EDNA, NOT_NAMED, ANNA, AGNES, DANIELLE, BERTHA, ABLE, ELSA",0.4927
BANGOR,"BRENDA, BERYL, EDOUARD, ARTHUR, HENRI, GLORIA, HORTENSE, CHARLEY, KYLE, ESTHER, IRENE, BETH, EARL, DIANE, DIANA, DOLLY, BILL, GLADYS, BERTHA, DANNY, ELSA, HERMINE, EDNA, CINDY, HEIDI, BLANCHE, GERDA, TEDDY, BELLE, ALBERTO, ALMA, BARBARA, BONNIE, ANA, LILI, BOB, CLEO, DONNA, NOT_NAMED, CAROL, DORIA, KAREN, FLOYD, CARRIE, OPHELIA, ABLE, DORIAN, JUAN, GINNY, GASTON",0.6049
BAR HARBOR,"BERTHA, BRENDA, DONNA, GLORIA, ANNA, ABLE, ALBERTO, ARTHUR, ARLENE, GLADYS, DORIA, HORTENSE, DIANE, HELENE, BARBARA, KYLE, GASTON, BETH, TEDDY, FLOYD, CLEO, JUAN, NOT_NAMED, ALMA, EDNA, BETSY, ANA, CAROL, CARRIE, BELLE, DANNY, IRENE, KAREN, ELSA, DOLLY, BOB, HENRI, ESTHER, OPHELIA, HERMINE, LILI, HEIDI, EARL, DORIAN, CHARLEY, CINDY, DIANA, BILL, BLANCHE, GERDA, GUSTAV, CRISTOBAL, BERYL, GINNY, BARRY, EDOUARD, BONNIE",0.6237
BARNEGAT,"BONNIE, DAVID, GASTON, DOG, SANDY, HOW, CRISTOBAL, EARL, CHARLEY, LILI, KYLE, ALBERTO, DEAN, IRENE, GINNY, ANDREW, ISAIAS, BETH, CAMILLE, IONE, ESTHER, GLORIA, HEIDI, DANNY, OPHELIA, CLAUDETTE, CONNIE, ODETTE, DAISY, CARRIE, HERMINE, HENRI, JOSEPHINE, EDOUARD, GERDA, DIANE, BRET, CINDY, ARLENE, HANNA, BARBARA, ARTHUR, MARIA, ALEX, DOLLY, JOSE, DENNIS, DORIA, DIANA, EDNA, ABLE, CAROL, FAY, FELIX, ANA, ISABEL, DORIAN, BERTHA, FLOYD, GUSTAV, BOB, HALLIE, BELLE, EMILY, HELENE, CLEO, DAWN, GLADYS, DANIELLE, ANNA, ELSA, AGNES, ALMA, NOT_NAMED, DONNA, BERYL, BRENDA, GABRIELLE",0.5701
BASS HARBOR,"CHARLEY, JUAN, LILI, BRENDA, ANNA, EARL, DANNY, KAREN, ARTHUR, HENRI, TEDDY, GLORIA, ESTHER, BOB, CAROL, EDNA, BERYL, ARLENE, GUSTAV, KYLE, FLOYD, BETSY, BARBARA, CARRIE, IRENE, ELSA, DIANA, GASTON, ALBERTO, HELENE, BLANCHE, GLADYS, BERTHA, GERDA, DIANE, DORIAN, DONNA, CRISTOBAL, HORTENSE, CLEO, BARRY, ANA, HERMINE, HEIDI, OPHELIA, BELLE, CINDY, DOLLY, BONNIE, ABLE, ALMA, EDOUARD, NOT_NAMED, DORIA, GINNY, BILL, BETH",0.6516
BATH,"DORIAN, ELSA, BOB, OPHELIA, ARTHUR, BRENDA, JOSE, ALBERTO, GASTON, HERMINE, ANNA, DIANA, LILI, BARBARA, CAROL, ALMA, DIANE, DOLLY, CINDY, BERTHA, GUSTAV, GERDA, ESTHER, DORIA, BELLE, BILL, GINNY, KYLE, CRISTOBAL, ABLE, CLEO, HORTENSE, GLADYS, EDNA, ARLENE, DONNA, CARRIE, AGNES, JUAN, HEIDI, NOT_NAMED, BERYL, IRENE, EDOUARD, EARL, FLOYD, BETH, HENRI, ANDREW, DAISY, HELENE, BLANCHE, CHARLEY, DANNY, BONNIE, GLORIA, KAREN",0.6024
BAYBORO,"SANDY, ETA, EDNA, DEAN, CLEO, DORIA, BELLE, HALLIE, MICHAEL, DAWN, GINNY, ABLE, MATTHEW, MARIA, HUGO, CHRIS, BETH, OPHELIA, BOB, KYLE, DORIAN, BLANCHE, DENNIS, OMAR, DORA, DAVID, ANDREA, ELLA, WILMA, ISABEL, ANDREW, FLORENCE, ALBERTO, ARTHUR, BERTHA, BARBARA, HERMINE, ESTHER, DOLLY, GASTON, CINDY, BRENDA, ELSA, GORDON, KATE, JOSE, GABRIELLE, ALMA, ANNA, HELENE, ALEX, GINGER, DIANA, DOTTIE, HANNA, CAROL, GLADYS, GUSTAV, KARA, NOT_NAMED, FAY, GRACIE, EMILY, AMY, CLARA, DANNY, DANIELLE, IRENE, JIG, ODETTE, DAISY, ERIN, AGNES, CLAUDETTE, EARL, IONE, ERNESTO, BILL, DOG, DIANE, BECKY, GERDA, IAN, ISAIAS, FELIX, FLOYD, BRET, HAZEL, COLIN, JOSEPHINE, ARLENE, HOW, ISBELL, FRAN, BERYL, CRISTOBAL, BETSY, HENRI, BONNIE, DONNA, CONNIE, GLORIA, JULIA, LILI, ANA, CHARLEY, CAMILLE, ISIDORE, KEITH",0.6524
BAYONNE,"ODETTE, ANDREW, NOT_NAMED, EMILY, GLADYS, OPHELIA, DANIELLE, GASTON, BOB, DOG, DOLLY, DONNA, DEAN, HEIDI, ALEX, SANDY, DORIA, FELIX, CINDY, ANNA, EDNA, HENRI, KYLE, LILI, CHARLEY, EDOUARD, ARLENE, DIANA, DIANE, DAVID, JOSEPHINE, GERDA, BELLE, FLOYD, CAMILLE, IONE, DAISY, CRISTOBAL, ELSA, ARTHUR, CONNIE, BERYL, BRET, MARIA, HOW, ISABEL, GLORIA, ESTHER, IRENE, BRENDA, AGNES, ABLE, CLAUDETTE, ALBERTO, DANNY, JOSE, FAY, HELENE, CARRIE, GUSTAV, BERTHA, ISAIAS, CAROL, ALMA, DAWN, BONNIE, HANNA, HERMINE, EARL, BARBARA, DENNIS, DORIAN",0.5438
BAYWAY,"DANNY, DIANA, LILI, GLORIA, FLOYD, IRENE, MARIA, DAWN, DAVID, ANDREW, BERTHA, CAROL, KYLE, ISABEL, DORIA, HANNA, ARLENE, JOSE, ARTHUR, HELENE, BELLE, CAMILLE, ALBERTO, GASTON, HEIDI, DANIELLE, ISAIAS, CARRIE, EDOUARD, CRISTOBAL, NOT_NAMED, DOG, DORIAN, DONNA, JOSEPHINE, ALEX, SANDY, CLAUDETTE, ALMA, EMILY, HENRI, AGNES, GUSTAV, BOB, BERYL, OPHELIA, DEAN, DIANE, HOW, CONNIE, IONE, GLADYS, EDNA, DOLLY, CHARLEY, ABLE, BRENDA, ODETTE, DAISY, HERMINE, GERDA, BARBARA, ELSA, BONNIE, FAY, BRET, ESTHER, FELIX, EARL, ANNA, DENNIS, CINDY",0.5462
BEAUFORT,"JEANNE, ISBELL, BRET, DANNY, BONNIE, FRAN, EDOUARD, CHARLEY, HELENE, EVE, DIANE, EMILY, CAMILLE, BELLE, EASY, FRANCES, ETA, CRISTOBAL, DORIAN, MATTHEW, AMY, KEITH, COLIN, BOB, IONE, DONNA, GORDON, ABBY, HOW, JOSE, GLADYS, ABLE, ANNA, CLAUDETTE, IRMA, CARRIE, ELOISE, HENRI, DAISY, ESTHER, FELIX, JOSEPHINE, ARLENE, AGNES, HEIDI, BERTHA, ALMA, DORA, DEBBY, HAZEL, ISABEL, IRENE, BETSY, EDNA, MINDY, GERDA, DORIA, GASTON, ALLISON, GERT, MARIA, BERYL, ANDREW, DANIELLE, ISIDORE, IAN, ZETA, DOG, BETH, HERMINE, HANNA, DIANA, EARL, KARA, JERRY, JANICE, JIG, ANDREA, ISAIAS, BLANCHE, MICHAEL, FLOYD, ARTHUR, DENNIS, CLEO, ALEX, SANDY, BARRY, GINNY, LOVE, GUSTAV, WILMA, OPHELIA, LILI, DEAN, DOTTIE, ODETTE, BILL, KATE, CAROL, ELSA, BRENDA, CHRIS, CONNIE, BARBARA, GRACIE, HUGO, ALBERTO, NOT_NAMED, GINGER, TAMMY, ELLA, FLORENCE, KYLE, NICOLE, ERIN, HUMBERTO, FRED, LESLIE, FAY, DAWN, OMAR, BECKY, DAVID, ANA, CLARA, GLORIA, GABRIELLE, CINDY, HALLIE, FLOSSY, DOLLY, JULIA, ERNESTO, KING",0.6094
BELFAST,"EDNA, BERYL, HORTENSE, DIANA, ARTHUR, BILL, ARLENE, NOT_NAMED, GLADYS, BETH, DORIA, GLORIA, OPHELIA, DIANE, EDOUARD, BOB, BLANCHE, DORIAN, IRENE, DANNY, GASTON, BARBARA, CINDY, ANNA, CRISTOBAL, GUSTAV, BERTHA, HERMINE, HENRI, BRENDA, CAROL, BONNIE, CHARLEY, ELSA, LILI, ABLE, GINNY, DOLLY, DONNA, KYLE, CARRIE, ALMA, EARL, ANA, HEIDI, BELLE, KAREN, ESTHER, CLEO, ALBERTO, JUAN, GERDA, TEDDY, FLOYD",0.6123
BELHAVEN,"BERTHA, FRAN, ABLE, BECKY, HOW, DORIAN, ALMA, BOB, ISBELL, HAZEL, ETA, JULIA, HALLIE, ANA, DORIA, EDNA, LILI, CLARA, GABRIELLE, GASTON, BILL, ODETTE, ALBERTO, DIANA, JOSEPHINE, MARIA, AMY, HUGO, GINGER, CHARLEY, GRACIE, BLANCHE, CHRIS, DAISY, BERYL, KATE, ELLA, CINDY, IONE, DONNA, OPHELIA, BELLE, DANNY, DOLLY, HELENE, ALEX, JOSE, HERMINE, KARA, BETH, GINNY, ARLENE, OMAR, GORDON, DENNIS, DIANE, ERNESTO, ANDREA, ANDREW, BETSY, FLOYD, WILMA, DOTTIE, ARTHUR, CONNIE, DANIELLE, COLIN, NOT_NAMED, KYLE, BRET, HANNA, IAN, FLORENCE, BONNIE, ERIN, MATTHEW, EMILY, DEAN, ELSA, ISIDORE, DAWN, MICHAEL, CRISTOBAL, IRENE, CAROL, AGNES, ISABEL, GLORIA, FELIX, SANDY, HENRI, ANNA, CAMILLE, FAY, DAVID, GERDA, GUSTAV, DOG, CLAUDETTE, GLADYS, BARBARA, CLEO, EARL, ISAIAS, BRENDA, ESTHER",0.6511
BEVERLY,"HERMINE, BRENDA, BOB, ALMA, ALBERTO, ESTHER, HENRI, HANNA, CHARLEY, ISAIAS, DIANA, HELENE, LILI, GLADYS, ARLENE, CRISTOBAL, JOSE, EDNA, CAROL, GASTON, DORIA, BERYL, BILL, CLEO, ARTHUR, KYLE, EARL, ELSA, BETSY, ANDREW, IONE, AGNES, GLORIA, GERDA, ANNA, DIANE, GINNY, IRENE, OPHELIA, DAVID, HEIDI, EDOUARD, BONNIE, HOW, BLANCHE, ABLE, CLAUDETTE, DORIAN, BARBARA, BETH, GUSTAV, DONNA, CARRIE, FAY, DOLLY, DANNY, KAREN, BELLE, NOT_NAMED, HORTENSE, BERTHA, DAISY, FLOYD, CINDY, EMILY",0.5858
BOOTHBAY HARBOR,"EARL, FLOYD, ANDREW, BARBARA, IRENE, ALMA, BELLE, JOSE, DIANE, DOLLY, HORTENSE, BERTHA, BILL, GLORIA, BERYL, HERMINE, DIANA, ABLE, EDOUARD, NOT_NAMED, ALBERTO, HELENE, KYLE, EDNA, OPHELIA, GLADYS, HEIDI, CRISTOBAL, KAREN, CINDY, CARRIE, BOB, DAISY, CHARLEY, ESTHER, CAROL, BLANCHE, GASTON, BONNIE, HENRI, ANNA, DORIAN, LILI, DORIA, JUAN, AGNES, ARLENE, TEDDY, BRENDA, GINNY, ARTHUR, ELSA, DANNY, DONNA, GERDA, BETH, CLEO, GUSTAV",0.5994
BOSTON,"CLEO, GUSTAV, BETH, EMILY, SANDY, BILL, GASTON, KAREN, BONNIE, CRISTOBAL, CAROL, CHARLEY, BERYL, DAISY, ALBERTO, BOB, HORTENSE, HEIDI, NOT_NAMED, HOW, BLANCHE, AGNES, ANNA, DIANE, BARBARA, HELENE, CLAUDETTE, ALMA, ABLE, BERTHA, EDOUARD, CINDY, ESTHER, CARRIE, JOSE, GINNY, HERMINE, ELSA, ISAIAS, OPHELIA, DORIA, HENRI, EDNA, DAVID, ARLENE, GLORIA, IRENE, GLADYS, DANNY, GERDA, BELLE, DOG, FAY, LILI, DONNA, IONE, ANDREW, BRENDA, HANNA, DORIAN, EARL, DIANA, ARTHUR, KYLE, DOLLY, BETSY, FLOYD",0.5992
BRIDGEPORT,"ALBERTO, CONNIE, CAROL, DANNY, ABLE, ARTHUR, BOB, HANNA, JOSE, EDOUARD, HOW, SANDY, BONNIE, FAY, CLAUDETTE, ALMA, CRISTOBAL, CHARLEY, EARL, GUSTAV, CINDY, IRENE, GASTON, DANIELLE, CAMILLE, EMILY, ARLENE, HENRI, BERTHA, DOLLY, ANNA, ODETTE, ISAIAS, ELSA, LILI, GERDA, GLORIA, ESTHER, DOG, DAVID, NOT_NAMED, EDNA, DEAN, BARBARA, IONE, BRENDA, DONNA, ANDREW, DORIAN, HEIDI, DAISY, DORIA, AGNES, DIANA, FLOYD, BELLE, BERYL, OPHELIA, DIANE, CARRIE, GLADYS, HERMINE, ALEX, HELENE, KYLE",0.5299
BRISTOL,"GLADYS, CRISTOBAL, NOT_NAMED, DIANA, HERMINE, EDOUARD, DENNIS, BRENDA, BILL, ANDREW, BELLE, GLORIA, BONNIE, HENRI, CONNIE, OPHELIA, DONNA, DOLLY, SANDY, ISAIAS, CHARLEY, GUSTAV, DANNY, LILI, CARRIE, MARIA, BOB, ESTHER, FELIX, CINDY, ALBERTO, GINNY, IONE, CAMILLE, ABLE, ISABEL, BETH, ELSA, DAVID, BETSY, HEIDI, DORIAN, DOG, CLAUDETTE, ALEX, EMILY, JOSE, IRENE, HANNA, GABRIELLE, EDNA, DORIA, CLEO, HELENE, DEAN, GASTON, BERTHA, BLANCHE, FAY, ARTHUR, JOSEPHINE, BERYL, HOW, HORTENSE, DAWN, ODETTE, HALLIE, BRET, ARLENE, DAISY, GERDA, EARL, BARBARA, KYLE, KATIA, AGNES, DANIELLE, DIANE, ANNA, ALMA, CAROL, FLOYD",0.5769
BROOKLIN,"ABLE, BILL, GERDA, BONNIE, BETSY, HORTENSE, ELSA, BETH, CLEO, KYLE, HELENE, ALBERTO, EARL, ALMA, GINNY, DORIA, IRENE, ANA, GASTON, HENRI, BLANCHE, BARRY, HERMINE, BARBARA, CRISTOBAL, GLORIA, DIANA, KAREN, HEIDI, BRENDA, DOLLY, JUAN, ANNA, FLOYD, CAROL, DAISY, ESTHER, ARLENE, TEDDY, LILI, GLADYS, CHARLEY, CINDY, BOB, ARTHUR, DONNA, EDOUARD, DANNY, BERTHA, DORIAN, EDNA, BERYL, DIANE, OPHELIA, GUSTAV, BELLE, CARRIE, NOT_NAMED",0.6408
BROOKLYN,"ARLENE, HERMINE, ALMA, JOSE, DANIELLE, ARTHUR, HEIDI, BRENDA, DONNA, MARIA, GASTON, GLADYS, BELLE, CAMILLE, HOW, CRISTOBAL, ALBERTO, OPHELIA, IRENE, ISAIAS, KYLE, LILI, NOT_NAMED, ABLE, HANNA, CINDY, EDOUARD, DAVID, DANNY, DIANE, FAY, ALEX, CLAUDETTE, BONNIE, DOLLY, IONE, EARL, BRET, FELIX, BARBARA, EDNA, DENNIS, ISABEL, BERTHA, GLORIA, DORIAN, EMILY, CAROL, HENRI, DAWN, BOB, GUSTAV, DAISY, CONNIE, DORIA, GERDA, ODETTE, ANDREW, DEAN, DIANA, AGNES, ANNA, BERYL, SANDY, DOG, JOSEPHINE, CARRIE, CHARLEY, HELENE, FLOYD, ESTHER, ELSA",0.5484
BRUNSWICK,"ETA, ABLE, BRENDA, CLAUDETTE, DORA, HUGO, MICHAEL, DANNY, HENRI, BECKY, TAMMY, JEANNE, FLOYD, CINDY, EDOUARD, FLOSSY, CHRIS, DONNA, FLORENCE, EMILY, ABBY, DIANA, FRED, GLADYS, DENNIS, EASY, ISIDORE, FRANCES, NOT_NAMED, NICOLE, DAVID, IRMA, CRISTOBAL, CAROL, BERYL, IAN, KEITH, ALICE, SALLY, GASTON, DORIA, HAZEL, BARRY, ERIN, DEBBIE, ALLISON, FRAN, ERNESTO, JERRY, ANDREA, EARL, JUDITH, HOW, JULIA, WILMA, DIANE, BERTHA, MINDY, OPHELIA, KATE, ELOISE, LOVE, HERMINE, ALEX, ELSA, LESLIE, KING, ISABEL, DOLLY, CHARLEY, COLIN, CONNIE, ANDREW, ARTHUR, ALBERTO, DOTTIE, MATTHEW, BOB, ELENA, DAWN, HELENE, DORIAN, DEBBY, BARBARA, GABRIELLE, OPAL, MARCO, ANA, GERDA, BONNIE, KYLE, ALMA, IRENE, CLEO, AGNES, EVE, FAY, GRACIE, ISAIAS, JOSEPHINE, HANNA, HALLIE, GINNY, GORDON, HUMBERTO, ISBELL",0.5809
BUCKS HARBOR,"DORIA, ALBERTO, ELSA, BERYL, BARBARA, BONNIE, CHARLEY, BERTHA, ABLE, CINDY, HENRI, DORIAN, LILI, HEIDI, GASTON, DANNY, HORTENSE, ALMA, ARTHUR, GINNY, ANNA, GERDA, CLEO, BELLE, ESTHER, CAROL, BETH, BLANCHE, BILL, KYLE, OPHELIA, ANA, DONNA, BRENDA, HELENE, ARLENE, GLORIA, EDOUARD, EARL, TEDDY, BOB, CRISTOBAL, EDNA, IRENE, NOT_NAMED, DOLLY, FLOYD, DIANA, KAREN, JUAN, GLADYS, CARRIE, GUSTAV, DIANE, HERMINE",0.6284
BUCKSPORT,"DONNA, KYLE, DORIA, HENRI, BERTHA, CRISTOBAL, DIANE, EDOUARD, NOT_NAMED, DANNY, CAROL, HORTENSE, GLADYS, GASTON, CARRIE, EDNA, LILI, BILL, HEIDI, BERYL, GINNY, BLANCHE, ANA, ANNA, BETH, EARL, IRENE, CHARLEY, HERMINE, KAREN, ELSA, ARLENE, BELLE, DIANA, FLOYD, BOB, GERDA, ARTHUR, CINDY, BRENDA, OPHELIA, JUAN, DOLLY, ALMA, BONNIE, ESTHER, ABLE, ALBERTO, CLEO, TEDDY, DORIAN, GLORIA, BARBARA",0.6157
BURLINGTON,"DANIELLE, HELENE, DOLLY, ODETTE, DAWN, JOSEPHINE, CAROL, CRISTOBAL, BRET, DIANE, GLADYS, BERTHA, DOG, ANNA, ALMA, CLAUDETTE, OPHELIA, GASTON, CINDY, DORIAN, ARTHUR, ALEX, ISAIAS, FELIX, BOB, ISABEL, MARIA, CLEO, KYLE, ABLE, FLOYD, FAY, CARRIE, EDNA, EARL, IONE, BERYL, SANDY, CONNIE, GLORIA, IRENE, NOT_NAMED, HEIDI, BRENDA, ELSA, BONNIE, HALLIE, LILI, ARLENE, DAVID, DEAN, GUSTAV, JOSE, GERDA, HOW, HENRI, GABRIELLE, EDOUARD, ESTHER, DANNY, BARBARA, HANNA, BELLE, EMILY, DORIA, CHARLEY, DENNIS, AGNES, DONNA, HERMINE, ANDREW, DAISY, DIANA, CAMILLE",0.5437
CAMDEN,"EDOUARD, ALEX, KYLE, DIANE, ESTHER, BRENDA, AGNES, DORIAN, BILL, ANA, MARIA, HERMINE, DAVID, ARLENE, CHARLEY, FRAN, DIANA, FLOYD, DEAN, BARBARA, IONE, ELSA, TEDDY, EMILY, CAMILLE, CONNIE, ALMA, GLORIA, GINNY, OPHELIA, NOT_NAMED, HEIDI, EDNA, GERDA, DOLLY, IRENE, GUSTAV, DORIA, CLEO, CLAUDETTE, HANNA, ODETTE, BERYL, BELLE, JUAN, CRISTOBAL, GASTON, JOSEPHINE, BLANCHE, HORTENSE, HENRI, ABLE, GABRIELLE, HELENE, DONNA, BETH, DANNY, GLADYS, DENNIS, CAROL, EARL, BRET, DANIELLE, ARTHUR, JOSE, KAREN, LILI, ISABEL, ANDREW, BOB, HOW, ANNA, FELIX, ALBERTO, BONNIE, CINDY, ISAIAS, DAISY, DOG, SANDY, DAWN, FAY, HALLIE, BERTHA, CARRIE",0.5586
CANAVERAL HARBOR,"JEANNE, ARTHUR, LOVE, CLAUDETTE, ABBY, ETA, ELENA, DIANA, MICHAEL, FRANKLIN, DONNA, BOB, KING, NOT_NAMED, ISBELL, BARRY, LESLIE, JERRY, CINDY, JENNY, DANNY, ABLE, AGNES, GINNY, CRISTOBAL, DAWN, MATTHEW, BONNIE, FAY, EMILY, FLOYD, IRENE, HERMINE, IRMA, DOTTIE, ERIKA, BARBARA, ISIDORE, KYLE, FRED, KATE, ISAIAS, GABRIELLE, OPHELIA, DAISY, MARCO, ISABEL, GEORGES, FLOSSY, HANNA, BERYL, DORIAN, DEBBY, MITCH, KATRINA, ANDREW, GERDA, ELSA, BETSY, JOSEPHINE, ALEX, MINDY, HOW, DORIA, BRENDA, NICOLE, ALMA, KEITH, GASTON, CONNIE, BRET, INEZ, EASY, CLEO, GORDON, HELENE, FRAN, GRETA, HUMBERTO, SANDY, TAMMY, DORA, HUGO, CHRIS, IAN, GLADYS, WILMA, EDOUARD, FABIAN, EVE, DOLLY, NOEL, DAVID, FRANCES, DENNIS, BECKY, COLIN, HARVEY, EARL, CAROL, ALBERTO, ELLA, HALLIE, HENRI, FLORENCE, ALLISON, JUDITH, ERIN, SALLY, ANDREA, CHARLEY, JIG, ANA, EDNA, HAZEL, BERTHA, JULIA, GRACIE, ERNESTO",0.7871
CAPE CHARLES,"IONE, JOSEPHINE, ISAIAS, DOLLY, BERTHA, DIANA, SANDY, DANIELLE, GASTON, FELIX, HALLIE, DAISY, ANA, AGNES, HOW, FAY, HENRI, DANNY, AMY, DEAN, MARIA, CAMILLE, CHRIS, ANNA, ISABEL, MATTHEW, BLANCHE, ALEX, DONNA, ANDREW, DAWN, GLADYS, BECKY, HERMINE, BOB, BILL, EDNA, GLORIA, FLOYD, DENNIS, BRET, ODETTE, CAROL, OPHELIA, CLAUDETTE, ESTHER, ISIDORE, BARBARA, EMILY, LILI, GINGER, BETH, CHARLEY, CARRIE, ELSA, ARTHUR, CONNIE, JOSE, GORDON, EARL, CINDY, MICHAEL, OMAR, NOT_NAMED, ISBELL, CRISTOBAL, GINNY, BONNIE, ARLENE, GERDA, HAZEL, CLEO, DAVID, GUSTAV, HELENE, BERYL, DOG, BETSY, HANNA, KATE, DORIAN, BELLE, ALMA, ABLE, CLARA, ERNESTO, FLORENCE, IRENE, FRAN, GABRIELLE, DIANE, KYLE, DORIA, BRENDA",0.6158
CARTERET,"EMILY, SANDY, ELSA, FLOYD, BARBARA, DANNY, ISABEL, FELIX, FAY, DAWN, HANNA, EARL, BERYL, HELENE, CINDY, ARTHUR, ESTHER, CAROL, IRENE, DAISY, GASTON, AGNES, IONE, BRENDA, CHARLEY, MARIA, KYLE, CAMILLE, DORIA, OPHELIA, BONNIE, ALEX, DAVID, HERMINE, EDOUARD, LILI, DONNA, DIANE, CRISTOBAL, ALMA, ODETTE, DEAN, CLAUDETTE, CARRIE, ISAIAS, ABLE, HEIDI, BERTHA, CONNIE, GERDA, BELLE, DANIELLE, ALBERTO, DOG, HOW, GLORIA, EDNA, ANDREW, DOLLY, JOSEPHINE, DORIAN, DENNIS, GLADYS, ANNA, BOB, NOT_NAMED, JOSE, ARLENE, HENRI, DIANA, BRET, GUSTAV",0.5448
CASTINE,"GINNY, EDNA, ARLENE, JUAN, BARBARA, BERYL, ELSA, ARTHUR, ANNA, FLOYD, NOT_NAMED, CARRIE, DOLLY, HENRI, GUSTAV, BELLE, KAREN, HERMINE, GERDA, DIANA, ABLE, TEDDY, BLANCHE, HORTENSE, HEIDI, OPHELIA, BILL, ALMA, ESTHER, CINDY, ALBERTO, DORIAN, CRISTOBAL, DANNY, CAROL, BERTHA, LILI, EDOUARD, ANA, CLEO, BRENDA, IRENE, GASTON, BOB, GLADYS, CHARLEY, DIANE, BONNIE, KYLE, EARL, DORIA, GLORIA, DONNA, BETH",0.6189
CATSKILL,"EARL, CAROL, ABLE, OPHELIA, GLORIA, BELLE, ALBERTO, BERTHA, ELSA, NOT_NAMED, DANIELLE, DAISY, FAY, ALMA, ESTHER, BARBARA, BONNIE, ARTHUR, IONE, HELENE, JOSE, AGNES, HEIDI, BRENDA, IRENE, CHARLEY, CONNIE, DANNY, FLOYD, SANDY, CARRIE, EDOUARD, HENRI, CINDY, ISAIAS, DIANE, EDNA, GERDA, DAVID, DORIA, BOB, BERYL, HERMINE, DONNA, HANNA, GASTON",0.4801
CHARLESTON,"BARBARA, HERMINE, NICOLE, GASTON, CLEO, ABBY, CAROL, CHRIS, ANDREW, ARTHUR, NOT_NAMED, HUGO, GORDON, ETA, DONNA, IRENE, DORA, BRENDA, KING, MICHAEL, CINDY, OPHELIA, FLOYD, TAMMY, CHARLEY, ELSA, COLIN, KEITH, MATTHEW, HAZEL, MINDY, HELENE, GRACIE, FLOSSY, ISABEL, GINNY, AMY, ISAIAS, DENNIS, EDNA, EVE, KYLE, ZETA, ALMA, DIANA, DAVID, BELLE, ISIDORE, EDOUARD, KARA, DIANE, ERNESTO, IONE, ANA, GLADYS, BERYL, IRMA, FRANCES, BONNIE, EMILY, GUSTAV, LOVE, CRISTOBAL, DAWN, ABLE, HALLIE, GLORIA, BERTHA, JEANNE, GINGER, CONNIE, FRAN, GABRIELLE, ANDREA, ALBERTO, FLORENCE, HANNA, JOSEPHINE, HOW, FAY, JULIA, GERDA, HUMBERTO, IAN, WILMA, BRET, CLAUDETTE, LESLIE, AGNES, DANNY, BOB, EASY, ELLA, DEBBY, DORIAN, DORIA, DOLLY, ALEX, DOTTIE, KATE, ISBELL, ALLISON, EARL",0.5883
CHESTER,"DORIA, SANDY, DOLLY, BERYL, CAMILLE, BELLE, CRISTOBAL, FAY, GLADYS, HALLIE, DAISY, CINDY, OPHELIA, JOSE, HERMINE, GABRIELLE, HOW, DAVID, DEAN, GERDA, FREDERIC, HANNA, ARLENE, CHARLEY, DOG, DAWN, ANNA, DIANA, MARIA, CLEO, DIANE, BONNIE, GLORIA, FLOYD, BARBARA, EARL, GASTON, ABLE, HENRI, ALEX, ANDREW, EDNA, BOB, BERTHA, ODETTE, HELENE, ARTHUR, JOSEPHINE, KYLE, IONE, CONNIE, ISABEL, DONNA, DORIAN, NOT_NAMED, CARRIE, IRENE, DENNIS, DANIELLE, ELSA, CAROL, DANNY, AGNES, FELIX, ISAIAS, BRET, FRAN, ESTHER, BRENDA, GUSTAV, CLAUDETTE, ALMA, EMILY",0.5162
CHROME,"IRENE, AGNES, BELLE, CARRIE, ALEX, ARTHUR, DOG, BERYL, DANIELLE, ALBERTO, MARIA, JOSE, DAVID, GUSTAV, KYLE, HELENE, BONNIE, ALMA, ABLE, IONE, DONNA, DENNIS, HERMINE, ODETTE, DIANE, BRENDA, ELSA, ANNA, CAMILLE, ARLENE, DANNY, ISABEL, GLORIA, CHARLEY, FAY, BRET, SANDY, LILI, BERTHA, FLOYD, DAISY, GASTON, CONNIE, CRISTOBAL, HENRI, OPHELIA, GERDA, EARL, HOW, EDOUARD, CAROL, HANNA, BARBARA, GLADYS, ESTHER, ISAIAS, BOB, DOLLY, DAWN, EDNA, FELIX, NOT_NAMED, CINDY, DORIA, ANDREW, DIANA, JOSEPHINE, CLAUDETTE, DORIAN, DEAN, HEIDI, EMILY",0.5452
CITY ISLAND,"HENRI, ALEX, DANNY, JOSEPHINE, BRENDA, GLORIA, DAISY, EMILY, GLADYS, DORIAN, FELIX, BONNIE, DIANA, ELSA, DAWN, OPHELIA, ANNA, BARBARA, BERYL, EDNA, DEAN, BOB, CAROL, ANDREW, AGNES, HERMINE, ARTHUR, GERDA, ALBERTO, HELENE, CLAUDETTE, BRET, JOSE, CHARLEY, DOG, ISAIAS, ALMA, ESTHER, GASTON, NOT_NAMED, CRISTOBAL, FAY, DIANE, FLOYD, HOW, CINDY, EDOUARD, ABLE, IRENE, DORIA, CAMILLE, DONNA, ARLENE, DANIELLE, SANDY, ODETTE, CONNIE, LILI, IONE, BELLE, HANNA, CARRIE, EARL, KYLE, BERTHA, DOLLY, DAVID, HEIDI, GUSTAV, MARIA",0.5413
COLUMBIA,"DONNA, BOB, ISAIAS, GERDA, DIANA, KATE, CARRIE, ISABEL, HUGO, JOSEPHINE, ANNA, DOLLY, BARBARA, NOT_NAMED, AGNES, ANDREW, CHRIS, ODETTE, ARTHUR, MARIA, DIANE, GLADYS, GORDON, DANIELLE, GLORIA, CINDY, DOG, FELIX, OMAR, KARA, BECKY, CLAUDETTE, GASTON, GRACIE, HENRI, SANDY, IRENE, HAZEL, ANDREA, DEAN, ISIDORE, ELSA, ERNESTO, MICHAEL, EMILY, BETSY, CLARA, CHARLEY, JOSE, JULIA, BRENDA, DOTTIE, BELLE, IONE, ESTHER, ARLENE, BONNIE, CRISTOBAL, AMY, FAY, ERIN, DAWN, HOW, DANNY, GABRIELLE, EARL, HANNA, BRET, FLORENCE, CAMILLE, IAN, DENNIS, KYLE, FLOYD, WILMA, BERYL, LILI, CAROL, ALMA, DAVID, BLANCHE, DORIA, EDNA, ALEX, ALBERTO, CLEO, BETH, ETA, GINGER, OPHELIA, ABLE, ANA, ISBELL, CONNIE, ELLA, DAISY, BILL, HALLIE, FRAN, MATTHEW, DORIAN, HERMINE, GUSTAV, BERTHA, COLIN, GINNY, HELENE",0.6430
COREA,"GINNY, DORIAN, DANNY, GUSTAV, DORIA, DONNA, BELLE, BETH, EDNA, ALMA, TEDDY, HELENE, CHARLEY, DIANA, DOLLY, OPHELIA, BARBARA, CARRIE, BOB, CAROL, BARRY, BONNIE, KAREN, LILI, JUAN, ARLENE, ESTHER, IRENE, BRENDA, KYLE, ANNA, HERMINE, GERDA, ABLE, ANA, EDOUARD, ELSA, CINDY, ALBERTO, HEIDI, DIANE, ARTHUR, GLADYS, CLEO, BERTHA, GLORIA, NOT_NAMED, BILL, EARL, HENRI, GASTON, HORTENSE, BETSY, BLANCHE, FLOYD, BERYL, CRISTOBAL",0.6195
CRIEHAVEN,"BILL, ARLENE, DOLLY, BRENDA, DIANA, HORTENSE, CHARLEY, CINDY, GASTON, ANA, BERYL, IRENE, GLADYS, ESTHER, ALMA, DORIA, ALBERTO, ANNA, BARRY, BLANCHE, NOT_NAMED, ARTHUR, BETSY, HENRI, BONNIE, HEIDI, EDNA, ABLE, JUAN, KYLE, CARRIE, GERDA, FLOYD, ANDREW, JOSE, LILI, HELENE, DANNY, BOB, ELSA, BERTHA, EDOUARD, EARL, DONNA, BETH, CAROL, HERMINE, OPHELIA, DAISY, KAREN, TEDDY, BELLE, GLORIA, GUSTAV, DIANE, BARBARA, DORIAN, CRISTOBAL, CLEO, GINNY",0.6226
CUNDY HARBOR,"BARBARA, ANDREW, BONNIE, BERYL, ARLENE, NOT_NAMED, ALMA, GLADYS, BOB, DOLLY, ARTHUR, DORIA, OPHELIA, HEIDI, JOSE, BERTHA, EARL, CLEO, CAROL, DORIAN, ESTHER, EDOUARD, GINNY, HENRI, DANNY, ELSA, ANNA, DAISY, AGNES, DIANA, CRISTOBAL, GASTON, KYLE, BELLE, EDNA, CHARLEY, FLOYD, HORTENSE, BILL, BETH, GUSTAV, HERMINE, LILI, ABLE, BLANCHE, DONNA, IRENE, GERDA, JUAN, DIANE, CARRIE, GLORIA, BRENDA, HELENE, ALBERTO, KAREN, CINDY",0.6059
DARIEN,"HANNA, GABRIELLE, OPHELIA, DORA, HUMBERTO, KEITH, OPAL, HAZEL, LOVE, JOSEPHINE, ERNESTO, DAWN, HENRI, FRED, DOLLY, BRENDA, DOTTIE, ELOISE, FAY, DONNA, ALMA, AGNES, BERTHA, JUDITH, GLADYS, WILMA, CONNIE, DORIA, ABBY, MARCO, BERYL, FLORENCE, EARL, DENNIS, ALICE, IRMA, BARRY, JERRY, BECKY, HELENE, EVE, KATE, DIANA, ANDREW, KING, GRACIE, GASTON, CAROL, DIANE, CHRIS, GLORIA, LESLIE, DEBBIE, IAN, ABLE, MICHAEL, NICOLE, IRENE, HOW, CINDY, COLIN, CHARLEY, JEANNE, CRISTOBAL, CLAUDETTE, DORIAN, HERMINE, EDOUARD, ALBERTO, ETA, ARTHUR, ANA, ZETA, JULIA, FLOSSY, DEBBY, GINNY, ALEX, EMILY, ELENA, HALLIE, DANNY, CLEO, ISBELL, BONNIE, BARBARA, FLOYD, HUGO, ISABEL, FRANCES, TAMMY, GERDA, EASY, ELSA, MATTHEW, KYLE, ALLISON, ISAIAS, BOB, NOT_NAMED, ISIDORE, GORDON, FRAN, ANDREA, DAVID, MINDY, ERIN",0.5695
DAVISVILLE DEPOT,"ISAIAS, CHARLEY, KYLE, DAISY, ALBERTO, GUSTAV, IRENE, DOLLY, BETSY, GINNY, HENRI, ANNA, LILI, EARL, ALEX, HOW, CINDY, HANNA, GLADYS, BILL, BRENDA, BOB, ARLENE, GASTON, HEIDI, DANIELLE, IONE, CARRIE, BARBARA, CLEO, BLANCHE, ODETTE, ANDREW, DAVID, ALMA, FAY, CLAUDETTE, DOG, ABLE, GERDA, DONNA, HELENE, NOT_NAMED, DANNY, ESTHER, JOSE, SANDY, BONNIE, FLOYD, DORIA, DORIAN, ARTHUR, BERTHA, BETH, OPHELIA, ELSA, CAROL, GLORIA, EDNA, EDOUARD, DIANA, EMILY, CRISTOBAL, BERYL, BELLE, AGNES, HERMINE, DIANE",0.6020
DEEPWATER POINT,"ALEX, HOW, DIANE, GLADYS, FAY, CHARLEY, BERYL, HERMINE, ODETTE, IRENE, DONNA, MARIA, FRAN, KYLE, ELSA, GLORIA, CRISTOBAL, OPHELIA, DANNY, NOT_NAMED, ESTHER, CLAUDETTE, GASTON, DENNIS, HELENE, ANDREW, GUSTAV, CARRIE, DOG, DAVID, BARBARA, DAWN, GERDA, EDNA, DIANA, BRET, FREDERIC, BONNIE, CLEO, ABLE, FLOYD, HALLIE, CAROL, ARLENE, AGNES, BELLE, DORIA, DOLLY, IONE, JOSE, BERTHA, CAMILLE, HANNA, DORIAN, ARTHUR, ANNA, CONNIE, ISAIAS, JOSEPHINE, HENRI, BOB, DAISY, DEAN, DANIELLE, ISABEL, CINDY, FELIX, GABRIELLE, EMILY, BRENDA, EARL, ALMA, SANDY",0.5137
EASTPORT,"ARTHUR, EDNA, ALMA, GUSTAV, CINDY, GASTON, DONNA, JUAN, KYLE, DORIAN, BLANCHE, BERYL, HEIDI, NOT_NAMED, ABLE, CLEO, BETSY, BARBARA, ARLENE, DOLLY, CHARLEY, ANA, DIANA, DORIA, GLADYS, ALBERTO, BARRY, LILI, OPHELIA, HERMINE, BRENDA, BOB, GINNY, ANNA, CAROL, ESTHER, GERDA, HORTENSE, EARL, BILL, BERTHA, CRISTOBAL, DIANE, BETH, KAREN, EDOUARD, BONNIE, BECKY, TEDDY",0.6118
