port_name,storm_names,average_category
PROVIDENCE,"DIANE, CARRIE, BETH, DAISY, CRISTOBAL, BARBARA, JOSE, BILL, EARL, ARTHUR, AGNES, ANNA, HOW, CAROL, HEIDI, NOT_NAMED, DONNA, ESTHER, DOLLY, CLAUDETTE, HELENE, DORIAN, DAVID, LILI, ELSA, BLANCHE, HENRI, EDNA, IONE, FAY, CHARLEY, CINDY, ALMA, GLORIA, BERTHA, GUSTAV, EDOUARD, HANNA, SANDY, ARLENE, DANNY, HERMINE, DOG, ISAIAS, BETSY, GERDA, ANDREW, BOB, BERYL, KYLE, GINNY, ABLE, GASTON, BONNIE, EMILY, IRENE, ODETTE, BRENDA, BELLE, DORIA, GLADYS, CLEO, DANIELLE, OPHELIA, FLOYD, DIANA, ALBERTO",0.6134
PROVINCETOWN,"CAROL, CLAUDETTE, EARL, HERMINE, EMILY, BERTHA, GUSTAV, AGNES, HEIDI, ELSA, ANNA, ALBERTO, CINDY, HENRI, BETH, ARTHUR, CLEO, DOLLY, OPHELIA, BERYL, BRENDA, GINNY, BELLE, DAISY, ESTHER, EDNA, DOG, CHARLEY, FELIX, FRANCES, ANA, EDOUARD, FLOYD, GLADYS, GASTON, ALMA, DIANA, BARRY, JOSE, ABLE, KYLE, DORIAN, BETSY, DANNY, LILI, CARRIE, KATIA, ISAIAS, BOB, DORIA, IRENE, ARLENE, BONNIE, BILL, NOT_NAMED, BARBARA, GERDA, GLORIA, DIANE, IONE, CRISTOBAL, TEDDY, KAREN, HOW, ALEX, DONNA, ANDREW, ODETTE, HELENE, SANDY, HORTENSE, BLANCHE, HANNA, FAY",0.6672
QUINCY,"EMILY, KAREN, BERYL, DORIAN, ALMA, BELLE, KYLE, SANDY, LILI, BOB, HORTENSE, DIANE, CAROL, BETSY, DOLLY, GASTON, DORIA, DONNA, JOSE, CINDY, HENRI, CHARLEY, GLORIA, HOW, DANNY, DOG, DAVID, EARL, HERMINE, IONE, GLADYS, ABLE, BETH, ANNA, DAISY, BILL, BLANCHE, ARLENE, AGNES, FAY, ESTHER, CARRIE, FLOYD, HANNA, IRENE, HELENE, BARBARA, GINNY, EDNA, NOT_NAMED, BERTHA, HEIDI, ALBERTO, ARTHUR, BONNIE, ELSA, CLEO, BRENDA, EDOUARD, DIANA, GERDA, ISAIAS, CRISTOBAL, GUSTAV, CLAUDETTE, OPHELIA, ANDREW",0.6095
QUONSET POINT,"ALEX, BETH, DAVID, ODETTE, DORIA, CLEO, BERYL, OPHELIA, IONE, HEIDI, BOB, CHARLEY, BERTHA, JOSE, HELENE, DOG, LILI, ARLENE, DANIELLE, GERDA, CINDY, EDOUARD, GASTON, EARL, FAY, EDNA, DAISY, BETSY, HENRI, DORIAN, ANNA, BRENDA, DIANE, ARTHUR, ABLE, DIANA, AGNES, DOLLY, ESTHER, HOW, BILL, ELSA, ALMA, ANDREW, DANNY, HERMINE, CARRIE, FLOYD, BARBARA, DONNA, GLORIA, EMILY, BLANCHE, SANDY, ISAIAS, CLAUDETTE, KYLE, CAROL, GLADYS, BELLE, GUSTAV, CRISTOBAL, GINNY, NOT_NAMED, HANNA, IRENE, ALBERTO, BONNIE",0.6039
RENSSELAER,"DANIELLE, BRENDA, HANNA, OPHELIA, CAROL, DAVID, BOB, CHARLEY, ALBERTO, HELENE, HENRI, DANNY, GLORIA, HEIDI, NOT_NAMED, ARTHUR, DIANE, CONNIE, EARL, DONNA, BERTHA, SANDY, BARBARA, IRENE, BERYL, EDNA, AGNES, EDOUARD, FLOYD, ESTHER, GASTON, DAISY, DORIA, BELLE, GERDA, FAY, ELSA, ISAIAS, ABLE, CINDY, HERMINE, ALMA, CARRIE",0.4651
RICHMOND,"HOW, DAISY, DAWN, ANNA, DIANE, BELLE, BONNIE, GLADYS, CRISTOBAL, KATE, BERYL, ANA, COLIN, BERTHA, DORIA, IRENE, GABRIELLE, HELENE, HANNA, SANDY, NOT_NAMED, GASTON, ISIDORE, BRET, HALLIE, ANDREW, ELSA, EDNA, ARTHUR, CONNIE, DENNIS, KYLE, CAROL, ALMA, ALEX, DORIAN, BOB, EMILY, BARBARA, CHARLEY, FELIX, GORDON, MATTHEW, ABLE, AMY, DANNY, DIANA, OPHELIA, HERMINE, CLEO, FAY, FLOYD, FRAN, GUSTAV, FREDERIC, CAMILLE, CINDY, BRENDA, IAN, MARIA, OMAR, AGNES, FLORENCE, DANIELLE, GLORIA, IONE, HUGO, ODETTE, ISBELL, ARLENE, DOLLY, EARL, GERDA, MICHAEL, HAZEL, ISAIAS, ERNESTO, ESTHER, GINNY, HENRI, DEAN, CLAUDETTE, ISABEL, GRACIE, DONNA, DAVID, GINGER",0.5767
ROBINHOOD,"GINNY, BILL, JUAN, BERTHA, DOLLY, EDNA, ELSA, CAROL, BERYL, DORIAN, GLORIA, ANNA, DONNA, BARBARA, HEIDI, ALMA, HERMINE, HORTENSE, DIANA, GUSTAV, BONNIE, OPHELIA, ABLE, BRENDA, DANNY, GASTON, BLANCHE, GLADYS, DIANE, NOT_NAMED, IRENE, BOB, CRISTOBAL, ESTHER, LILI, ARLENE, HELENE, BELLE, ARTHUR, ALBERTO, KYLE, GERDA, FLOYD, CINDY, HENRI, AGNES, JOSE, ANDREW, CARRIE, EARL, KAREN, DAISY, CLEO, DORIA, BETH, CHARLEY, EDOUARD",0.6012
ROCKLAND,"DANNY, GASTON, ALMA, HELENE, FLOYD, CINDY, ESTHER, EDNA, GINNY, BERTHA, GLORIA, GLADYS, DIANE, EARL, BETH, HORTENSE, TEDDY, BONNIE, IRENE, BILL, DORIAN, ANA, BERYL, JOSE, DOLLY, ANNA, ARLENE, CHARLEY, ARTHUR, JUAN, GERDA, NOT_NAMED, LILI, CAROL, KYLE, BOB, DONNA, KAREN, CLEO, HEIDI, DAISY, DORIA, ELSA, BARBARA, BRENDA, GUSTAV, EDOUARD, ALBERTO, CARRIE, CRISTOBAL, ABLE, HERMINE, BLANCHE, BELLE, DIANA, HENRI, OPHELIA",0.6317
ROCKPORT,"DIANE, EMILY, ELSA, GLADYS, BRENDA, BETH, FLOYD, GINNY, KYLE, CLEO, JUAN, HANNA, ABLE, BONNIE, BERTHA, CHARLEY, DONNA, HELENE, DOLLY, GLORIA, DIANA, BARBARA, NOT_NAMED, CAROL, ISAIAS, GERDA, BETSY, KAREN, HOW, ESTHER, JOSE, CARRIE, CLAUDETTE, LILI, DORIAN, ARLENE, ALMA, BERYL, ANDREW, DORIA, AGNES, DAVID, HORTENSE, ANNA, FAY, IONE, DAISY, HENRI, EDOUARD, ARTHUR, EARL, IRENE, OPHELIA, CRISTOBAL, ALBERTO, BILL, TEDDY, BELLE, BOB, HERMINE, CINDY, DANNY, GUSTAV, BLANCHE, ANA, GASTON, EDNA, HEIDI",0.6070
SACO,"HORTENSE, DORIAN, FAY, ESTHER, BELLE, DOLLY, ARTHUR, CLEO, EARL, GLADYS, DONNA, CARRIE, DIANE, GLORIA, DANNY, HEIDI, BERTHA, OPHELIA, ANDREW, BERYL, DORIA, FLOYD, EDOUARD, ELSA, ABLE, BARBARA, HERMINE, ARLENE, GINNY, BETH, CINDY, ANNA, BOB, GASTON, NOT_NAMED, KYLE, CRISTOBAL, DAISY, ISAIAS, BLANCHE, CHARLEY, JOSE, HENRI, DIANA, EDNA, AGNES, KAREN, IRENE, BONNIE, GUSTAV, LILI, ALMA, BILL, HELENE, CAROL, ALBERTO, BRENDA, GERDA",0.5815
SALEM,"DORIA, CHARLEY, KAREN, FAY, ARTHUR, BRENDA, EDNA, BILL, DONNA, FLOYD, HEIDI, CLAUDETTE, ARLENE, DIANA, CLEO, HORTENSE, GLORIA, BARBARA, DOLLY, DIANE, CAROL, BELLE, ANDREW, OPHELIA, IRENE, CINDY, BERYL, ANNA, ALMA, CARRIE, BETSY, HENRI, BONNIE, DAISY, GASTON, GUSTAV, AGNES, HERMINE, ISAIAS, DANNY, HANNA, JOSE, ALBERTO, BOB, HELENE, EMILY, BERTHA, ESTHER, LILI, ABLE, BLANCHE, CRISTOBAL, DORIAN, EDOUARD, DAVID, HOW, EARL, GLADYS, GERDA, ELSA, NOT_NAMED, IONE, KYLE, GINNY, BETH",0.5858
SALEM NJ,"HENRI, DEAN, ABLE, JOSEPHINE, CAROL, NOT_NAMED, BONNIE, CRISTOBAL, JOSE, EARL, DIANA, CONNIE, CLAUDETTE, DANIELLE, CAMILLE, ISABEL, GABRIELLE, CINDY, CLEO, BERTHA, IRENE, AGNES, FAY, BRET, ARLENE, BELLE, ANDREW, CHARLEY, ESTHER, GUSTAV, GASTON, EMILY, HOW, DAWN, EDNA, OPHELIA, GLORIA, DORIA, DORIAN, ALMA, HANNA, ANNA, MARIA, CARRIE, BARBARA, SANDY, FRAN, DOG, BOB, ODETTE, BERYL, DONNA, HELENE, ARTHUR, ALEX, DOLLY, IONE, KYLE, ELSA, DENNIS, HERMINE, HALLIE, DAISY, DIANE, BRENDA, ISAIAS, GLADYS, GERDA, FELIX, DANNY, DAVID, FREDERIC, FLOYD",0.5338
SALISBURY,"ERNESTO, MATTHEW, EMILY, CARRIE, FAY, HANNA, ANDREW, CAMILLE, DIANE, LILI, FRAN, CINDY, ISABEL, HOW, ALMA, BARBARA, DANNY, BERTHA, DAISY, DOLLY, KYLE, BETH, HERMINE, DAVID, ALEX, GINNY, BELLE, DENNIS, BRENDA, BRET, BILL, MICHAEL, DAWN, SANDY, DIANA, GLADYS, FLORENCE, NOT_NAMED, CAROL, CONNIE, GINGER, GERDA, OPHELIA, MARIA, ELSA, GABRIELLE, DANIELLE, AMY, EARL, FELIX, DONNA, HENRI, FLOYD, ODETTE, ABLE, DORIA, CHARLEY, ANNA, CRISTOBAL, CLEO, IONE, DEAN, DOG, JOSE, ARTHUR, BERYL, KATE, ISBELL, ARLENE, ISIDORE, JOSEPHINE, GLORIA, CLAUDETTE, HELENE, FREDERIC, OMAR, AGNES, ISAIAS, BONNIE, ANA, DORIAN, GASTON, HALLIE, IRENE, GUSTAV, ESTHER, EDNA, BOB",0.5927
SANDYPOINT,"BARBARA, EDOUARD, EDNA, CINDY, DORIAN, CAROL, OPHELIA, BERTHA, DIANA, ALBERTO, ARTHUR, ELSA, BLANCHE, BOB, HEIDI, ANA, DIANE, ESTHER, DONNA, TEDDY, CLEO, BRENDA, NOT_NAMED, FLOYD, DORIA, DANNY, HORTENSE, GUSTAV, CRISTOBAL, ARLENE, BONNIE, KYLE, BELLE, GERDA, CHARLEY, BERYL, KAREN, ANNA, BILL, BETH, JUAN, ALMA, GLORIA, ABLE, DOLLY, GLADYS, LILI, GASTON, GINNY, IRENE, CARRIE, HERMINE, EARL, HENRI",0.6180
SAVANNAH,"BARRY, KING, HOW, LOVE, FRED, ISAIAS, ABLE, BECKY, DOLLY, ERIN, DORIAN, DAWN, EDNA, ERNESTO, GERDA, BRENDA, ANA, DOTTIE, HALLIE, BONNIE, EARL, MARCO, FRANCES, EASY, OPAL, ALICE, ALBERTO, CRISTOBAL, HUMBERTO, IONE, ISBELL, ABBY, OPHELIA, AGNES, ANDREA, HAZEL, KATE, ZETA, DENNIS, EVE, CLAUDETTE, FLOYD, TAMMY, MINDY, GLADYS, KYLE, DANNY, IRENE, GASTON, COLIN, MICHAEL, DORA, CLEO, GLORIA, GINGER, FRAN, GINNY, IAN, HANNA, IRMA, HELENE, JERRY, CONNIE, GRACIE, EDOUARD, HERMINE, FAY, BOB, ISIDORE, ELSA, ETA, JOSEPHINE, DAVID, ALLISON, NOT_NAMED, DIANA, ANDREW, HUGO, ISABEL, FLOSSY, FLORENCE, GORDON, CINDY, ARTHUR, DORIA, KEITH, BERTHA, NICOLE, ELOISE, MATTHEW, DONNA, GABRIELLE, CAROL, KARA, LESLIE, DEBBY, ALMA, JEANNE, ALEX, ELENA, JULIA, BERYL, CHRIS, DIANE, CHARLEY, BARBARA",0.5533
SAYREVILLE,"EDOUARD, DORIA, DIANA, DORIAN, CLEO, DAWN, ANNA, DANIELLE, HEIDI, NOT_NAMED, LILI, HANNA, BONNIE, AGNES, EARL, CONNIE, ANDREW, GLADYS, DIANE, CARRIE, BRENDA, GLORIA, GERDA, DANNY, ELSA, CAMILLE, DONNA, JOSEPHINE, KYLE, ARTHUR, HOW, BERTHA, DAVID, ODETTE, OPHELIA, DEAN, CAROL, DENNIS, ALBERTO, ESTHER, HELENE, GASTON, JOSE, ALMA, CHARLEY, CRISTOBAL, GUSTAV, IONE, EDNA, ALEX, BARBARA, HERMINE, HENRI, BELLE, CLAUDETTE, BRET, DAISY, ISAIAS, FAY, FLOYD, BOB, ABLE, SANDY, MARIA, EMILY, DOLLY, ARLENE, FELIX, CINDY, ISABEL, BERYL, IRENE, DOG",0.5392
SCITUATE,"HORTENSE, DIANA, ELSA, GUSTAV, GASTON, DANNY, CINDY, BONNIE, HEIDI, BERYL, BRENDA, HENRI, EDNA, GLADYS, HOW, IRENE, DORIAN, HELENE, DORIA, NOT_NAMED, JOSE, FLOYD, EARL, BETSY, AGNES, GINNY, DONNA, CRISTOBAL, DAVID, ARTHUR, CLEO, KAREN, CAROL, BILL, GERDA, ALMA, LILI, HANNA, BERTHA, DOLLY, BOB, BARBARA, IONE, ANDREW, BETH, CARRIE, ARLENE, HERMINE, ISAIAS, EMILY, EDOUARD, SANDY, GLORIA, ANNA, ABLE, DIANE, DAISY, ESTHER, ALBERTO, OPHELIA, BELLE, FAY, CHARLEY, BLANCHE, DOG, KYLE, CLAUDETTE",0.6162
SEARSPORT,"BLANCHE, NOT_NAMED, DIANA, ALBERTO, HERMINE, DORIA, CHARLEY, GLORIA, BERYL, ANA, ELSA, EARL, DANNY, DONNA, GUSTAV, ANNA, CAROL, GLADYS, CINDY, TEDDY, DIANE, BERTHA, GASTON, IRENE, DORIAN, EDNA, FLOYD, KYLE, BARBARA, HORTENSE, CRISTOBAL, BETH, ARLENE, DOLLY, HENRI, CLEO, BILL, BONNIE, ALMA, GINNY, ABLE, ESTHER, HEIDI, ARTHUR, BOB, BELLE, BRENDA, OPHELIA, CARRIE, GERDA, KAREN, LILI, EDOUARD, JUAN",0.6154
SEWAREN,"CONNIE, DAWN, CRISTOBAL, BRET, OPHELIA, IONE, HANNA, KYLE, FAY, EMILY, ELSA, DIANA, DORIAN, CAMILLE, ESTHER, HERMINE, SANDY, MARIA, IRENE, EDOUARD, BRENDA, BERYL, CINDY, BOB, DORIA, GERDA, CLAUDETTE, HENRI, FLOYD, JOSE, DIANE, CAROL, JOSEPHINE, LILI, ISAIAS, HOW, DENNIS, FELIX, DEAN, ARLENE, BELLE, GUSTAV, ARTHUR, AGNES, ODETTE, DOLLY, ABLE, DONNA, ANDREW, HEIDI, EDNA, ANNA, EARL, ALEX, DANIELLE, GLORIA, CARRIE, BERTHA, HELENE, DOG, GLADYS, ALMA, GASTON, BONNIE, ISABEL, DANNY, BARBARA, DAISY, DAVID, ALBERTO, NOT_NAMED, CHARLEY",0.5456
SOLOMONS ISLAND,"BRENDA, BRET, DIANA, DORIA, BELLE, HALLIE, CARRIE, DEAN, DAISY, DAVID, NOT_NAMED, HOW, CINDY, DANIELLE, JOSEPHINE, MICHAEL, LILI, ELSA, OPHELIA, ISAIAS, CAMILLE, FAY, HENRI, DENNIS, DORIAN, GUSTAV, GLADYS, SANDY, FREDERIC, FLORENCE, HERMINE, ESTHER, ABLE, AMY, DOG, MARIA, FRAN, ALMA, GINGER, KATE, CRISTOBAL, ISABEL, KYLE, CLAUDETTE, CONNIE, FLOYD, GERDA, ALEX, HANNA, HELENE, FELIX, ERNESTO, CAROL, BERTHA, BONNIE, CLEO, OMAR, EARL, AGNES, GABRIELLE, DIANE, MATTHEW, HUGO, DONNA, IRENE, ANNA, ANDREW, DAWN, DOLLY, ISBELL, IONE, ARTHUR, EDNA, DANNY, GLORIA, JOSE, ARLENE, BERYL, GINNY, CHARLEY, GASTON, ODETTE, ISIDORE, BARBARA, BOB, EMILY",0.5736
SORRENTO,"EARL, ANA, DOLLY, DORIAN, ALBERTO, GLORIA, LILI, KAREN, BARBARA, CLEO, ARTHUR, BRENDA, DIANE, BERTHA, CAROL, BILL, GUSTAV, CHARLEY, CARRIE, EDNA, DIANA, BELLE, HELENE, BLANCHE, HERMINE, TEDDY, BERYL, DANNY, ANNA, FLOYD, BETH, HENRI, GLADYS, DONNA, BETSY, CINDY, JUAN, EDOUARD, BARRY, IRENE, GERDA, HEIDI, GASTON, BONNIE, ABLE, CRISTOBAL, ALMA, DORIA, GINNY, OPHELIA, KYLE, ESTHER, ARLENE, HORTENSE, NOT_NAMED, ELSA, BOB",0.6286
SOUTH AMBOY,"EDNA, DOLLY, HANNA, CARRIE, GUSTAV, ELSA, BERYL, KYLE, ODETTE, IONE, DENNIS, DANIELLE, CONNIE, BOB, ALEX, CHARLEY, HOW, GLORIA, ALBERTO, IRENE, HEIDI, FELIX, ABLE, BERTHA, DAVID, GLADYS, GASTON, OPHELIA, BELLE, CAROL, CAMILLE, CRISTOBAL, AGNES, BRENDA, LILI, GERDA, ESTHER, ISABEL, SANDY, ARLENE, JOSE, DANNY, JOSEPHINE, DAISY, EARL, DORIA, EDOUARD, NOT_NAMED, FLOYD, DORIAN, ALMA, ISAIAS, BARBARA, BONNIE, DOG, FAY, DEAN, CLAUDETTE, EMILY, ARTHUR, HELENE, HENRI, ANDREW, DIANA, DIANE, DAWN, HERMINE, MARIA, BRET, CINDY, DONNA, ANNA",0.5479
SOUTH BRISTOL,"OPHELIA, KAREN, EDOUARD, BONNIE, ESTHER, DIANE, DONNA, CARRIE, ANNA, HENRI, ELSA, DORIA, CINDY, HORTENSE, CLEO, BELLE, HEIDI, BRENDA, ABLE, GLORIA, DANNY, NOT_NAMED, BERYL, EARL, DIANA, ARLENE, JOSE, ARTHUR, GASTON, BILL, LILI, DORIAN, HERMINE, GLADYS, BETH, GINNY, KYLE, ALMA, CRISTOBAL, IRENE, FLOYD, BARBARA, GUSTAV, CHARLEY, GERDA, ANDREW, DAISY, TEDDY, CAROL, DOLLY, BERTHA, BLANCHE, BOB, ALBERTO, AGNES, EDNA, JUAN, HELENE",0.5965
SOUTH HARPSWELL,"CINDY, ALBERTO, HEIDI, BELLE, CARRIE, EDOUARD, KAREN, ABLE, NOT_NAMED, GINNY, GLORIA, EDNA, GLADYS, CRISTOBAL, HELENE, GUSTAV, BERTHA, BERYL, ELSA, KYLE, EARL, GERDA, OPHELIA, DIANE, BILL, ANNA, ESTHER, BONNIE, BOB, ANDREW, AGNES, FLOYD, DOLLY, BLANCHE, BETH, BRENDA, LILI, CHARLEY, HERMINE, ARTHUR, CLEO, CAROL, DAISY, DANNY, DORIA, HORTENSE, DIANA, JOSE, IRENE, ALMA, GASTON, DORIAN, BARBARA, ARLENE, DONNA, HENRI",0.5877
SOUTHPORT,"MICHAEL, GRACIE, FELIX, ISAIAS, ANA, GLADYS, ETA, BERTHA, EARL, DOLLY, BOB, KYLE, CAMILLE, SANDY, BETSY, ABBY, ERIN, CINDY, DIANA, EDOUARD, AMY, HOW, GASTON, HERMINE, COLIN, BERYL, ABLE, LILI, CHRIS, GERDA, KARA, HEIDI, CARRIE, ODETTE, HAZEL, BLANCHE, GINNY, GORDON, WILMA, ALBERTO, FLORENCE, ALEX, GINGER, OMAR, KATE, ANDREW, DENNIS, JOSE, MARIA, ELLA, AGNES, BRET, ELSA, FRAN, DAVID, ISIDORE, EMILY, HUGO, DORIAN, KEITH, CAROL, BRENDA, IRENE, NOT_NAMED, FAY, IONE, HELENE, DAWN, DEAN, EDNA, CRISTOBAL, MATTHEW, JULIA, CHARLEY, ESTHER, ALMA, ARTHUR, HALLIE, DIANE, LESLIE, HUMBERTO, DORIA, CLAUDETTE, ISBELL, HANNA, ARLENE, BARBARA, IAN, CLEO, GLORIA, BELLE, ERNESTO, DOTTIE, OPHELIA, HENRI, DAISY, BILL, GABRIELLE, DOG, BONNIE, DANNY, DORA, ISABEL, ANDREA, BECKY, FLOYD, DANIELLE, ANNA, GUSTAV, DONNA, CONNIE, JIG",0.6316
SOUTHWEST HARBOR,"ELSA, HEIDI, GUSTAV, DOLLY, DORIA, BARRY, GLADYS, ARTHUR, GERDA, KAREN, ARLENE, ANA, HENRI, ALBERTO, LILI, NOT_NAMED, BERTHA, ANNA, JUAN, EARL, ABLE, HORTENSE, TEDDY, BILL, CHARLEY, GASTON, OPHELIA, CRISTOBAL, CAROL, GLORIA, GINNY, BONNIE, KYLE, CINDY, BERYL, DIANE, CARRIE, BARBARA, IRENE, DORIAN, EDNA, BETSY, BELLE, DONNA, FLOYD, BRENDA, ESTHER, DANNY, CLEO, HERMINE, BETH, BOB, ALMA, HELENE, DIANA, BLANCHE, EDOUARD",0.6469
ST AUGUSTINE,"ETA, LOVE, KYLE, ERNESTO, ELSA, KING, HUMBERTO, JUDITH, BONNIE, MITCH, ALMA, BRENDA, HAZEL, CINDY, DEBBY, EDNA, ISABEL, DORIA, HERMINE, DAVID, SALLY, HELENE, ELOISE, ALBERTO, ALICE, BECKY, CAROL, BERYL, EARL, JENNY, ALEX, CONNIE, DONNA, BRET, NOT_NAMED, IAN, ALLISON, JULIA, FRAN, GASTON, DANNY, OPHELIA, WILMA, HENRI, ARTHUR, IRENE, KEITH, FAY, DIANA, DAWN, EVE, DEBBIE, LESLIE, BARRY, TAMMY, CHRIS, DORIAN, NICOLE, ABBY, GERDA, AGNES, HANNA, ANA, ABLE, JERRY, HOW, HALLIE, DOLLY, DORA, ANDREW, EMILY, DENNIS, BERTHA, HUGO, ISBELL, FLORENCE, EDOUARD, KATRINA, CHARLEY, ANDREA, JOSEPHINE, GINNY, CLEO, MARCO, FLOSSY, ISAIAS, MATTHEW, COLIN, JEANNE, MICHAEL, FRED, ERIKA, BOB, MINDY, CLAUDETTE, EASY, ISIDORE, DOTTIE, BETSY, SANDY, GLADYS, KATE, FRANCES, GORDON, GRACIE, GABRIELLE, ERIN, FLOYD, IRMA, HARVEY, CRISTOBAL, DAISY, ELENA",0.6685
STAMFORD,"DIANA, HENRI, EDOUARD, ALBERTO, GERDA, DOG, HERMINE, ANNA, DORIA, ARTHUR, FAY, CLAUDETTE, ABLE, BOB, AGNES, DANIELLE, CARRIE, DONNA, NOT_NAMED, DANNY, CRISTOBAL, CONNIE, DIANE, BARBARA, BONNIE, HANNA, ODETTE, GLORIA, DAWN, CAROL, CAMILLE, BELLE, KYLE, GASTON, GUSTAV, IONE, DAISY, DOLLY, ANDREW, HOW, CINDY, LILI, HELENE, FLOYD, ARLENE, ALMA, DORIAN, ISAIAS, ESTHER, OPHELIA, JOSEPHINE, GLADYS, BRENDA, BERTHA, EARL, ELSA, CHARLEY, BERYL, ALEX, IRENE, DAVID, EMILY, DEAN, HEIDI, EDNA, SANDY, JOSE",0.5338
STAPLETON SI,"OPHELIA, HOW, BRET, DAVID, EMILY, DANNY, CONNIE, BERYL, CHARLEY, DAISY, BERTHA, FLOYD, ARLENE, JOSEPHINE, ISABEL, HERMINE, ELSA, GERDA, HEIDI, ESTHER, FAY, BOB, MARIA, IRENE, CARRIE, DANIELLE, ABLE, BRENDA, ODETTE, KYLE, DORIA, AGNES, ARTHUR, DAWN, DONNA, CRISTOBAL, NOT_NAMED, HENRI, HELENE, CINDY, GLADYS, EDOUARD, DIANA, GUSTAV, BARBARA, CLAUDETTE, ANDREW, EARL, ALMA, ALEX, GASTON, EDNA, BELLE, LILI, SANDY, CAMILLE, ISAIAS, DOLLY, FELIX, DORIAN, ANNA, DEAN, HANNA, DIANE, JOSE, DOG, ALBERTO, CAROL, DENNIS, BONNIE, IONE, GLORIA",0.5474
STONINGTON,"DAISY, BRENDA, DIANA, EMILY, FELIX, EDNA, BELLE, HORTENSE, LILI, BERTHA, CLEO, GLADYS, JUAN, DANIELLE, SANDY, BERYL, CINDY, DONNA, FAY, IRENE, GERDA, CRISTOBAL, TEDDY, FLOYD, BETSY, BOB, ESTHER, DENNIS, ANNA, CAROL, AGNES, BARRY, CARRIE, ELSA, EDOUARD, GASTON, CHARLEY, CONNIE, ISAIAS, ALBERTO, HEIDI, DORIA, HENRI, EARL, ODETTE, DORIAN, ALMA, JOSE, OPHELIA, CLAUDETTE, HELENE, DIANE, BARBARA, BILL, ARLENE, DOLLY, IONE, HERMINE, DAVID, BLANCHE, HANNA, ALEX, GINNY, BETH, NOT_NAMED, DANNY, DOG, GLORIA, KYLE, ABLE, GUSTAV, BONNIE, ANDREW, KAREN, HOW, ARTHUR, ANA",0.6117
SWANS ISLAND,"DORIAN, HEIDI, HORTENSE, GERDA, NOT_NAMED, GLORIA, BETH, ARTHUR, KAREN, EDOUARD, GINNY, DAISY, JUAN, BETSY, BELLE, TEDDY, CAROL, CLEO, BILL, HERMINE, BONNIE, BERYL, GLADYS, ALBERTO, BRENDA, ANA, GASTON, DANNY, GUSTAV, BLANCHE, ANNA, EDNA, ABLE, BARRY, CHARLEY, JOSE, DORIA, HENRI, DIANE, HELENE, CINDY, EARL, OPHELIA, CRISTOBAL, DIANA, DONNA, BOB, LILI, CARRIE, ARLENE, ESTHER, FLOYD, KYLE, ALMA, BARBARA, BERTHA, ELSA, DOLLY, IRENE",0.6378
SWANSBORO,"AMY, LILI, GINGER, DAVID, CLAUDETTE, ABLE, BONNIE, BETH, GUSTAV, HERMINE, ANNA, OMAR, DOTTIE, FLOYD, DEAN, MICHAEL, GINNY, IRENE, CAMILLE, KARA, JULIA, GORDON, BRET, JIG, CAROL, CONNIE, DIANE, BLANCHE, ODETTE, EDNA, MARIA, GERDA, DANNY, GABRIELLE, ISAIAS, DENNIS, ELSA, ETA, HUGO, ERNESTO, FAY, FLORENCE, DIANA, ANA, CHRIS, DOG, DORIAN, CHARLEY, ELLA, HAZEL, DANIELLE, CLARA, AGNES, ANDREA, HALLIE, BECKY, FELIX, GLADYS, GASTON, DORIA, BARBARA, CINDY, CLEO, BELLE, OPHELIA, BERYL, HOW, MATTHEW, SANDY, IAN, ISBELL, ALMA, ANDREW, ARTHUR, BOB, ISABEL, COLIN, GLORIA, GRACIE, WILMA, ERIN, DONNA, ALBERTO, DAWN, BILL, BERTHA, KEITH, NOT_NAMED, HENRI, IONE, EDOUARD, DAISY, BRENDA, DOLLY, FRAN, ESTHER, DORA, ISIDORE, KYLE, HANNA, EMILY, KATE, BETSY, HELENE, ARLENE, EARL, CRISTOBAL, ALEX",0.6519
THOMASTON,"KAREN, CLEO, GINNY, BERTHA, HELENE, DOLLY, OPHELIA, ANNA, DAISY, BLANCHE, ELSA, BRENDA, DORIAN, HENRI, GERDA, JUAN, DIANA, NOT_NAMED, LILI, ARTHUR, DANNY, GLADYS, JOSE, GUSTAV, BARBARA, IRENE, BILL, BOB, CAROL, EARL, HERMINE, HORTENSE, DORIA, ABLE, BONNIE, ARLENE, CRISTOBAL, EDNA, ESTHER, KYLE, BELLE, BETH, CHARLEY, DONNA, FLOYD, CARRIE, GLORIA, CINDY, HEIDI, EDOUARD, GASTON, DIANE, ALBERTO, ALMA, BERYL, TEDDY, ANA, ANDREW",0.6207
TIVERTON,"DANIELLE, ANDREW, FAY, ABLE, BERTHA, AGNES, EMILY, ELSA, BERYL, GLADYS, GASTON, DOG, ESTHER, CRISTOBAL, DOLLY, GERDA, DANNY, BRENDA, FLOYD, ANNA, DORIA, DONNA, GINNY, SANDY, BONNIE, HENRI, HEIDI, IONE, DIANA, BETH, ALMA, BETSY, CAROL, DAVID, EARL, ALBERTO, CINDY, BARBARA, KYLE, OPHELIA, GUSTAV, HORTENSE, HELENE, ARLENE, GLORIA, DORIAN, BLANCHE, ODETTE, BILL, ALEX, HANNA, HERMINE, CARRIE, CHARLEY, IRENE, NOT_NAMED, CLEO, BELLE, DIANE, ISAIAS, LILI, BOB, CLAUDETTE, EDOUARD, HOW, DAISY, KATIA, JOSE, ARTHUR, EDNA",0.6216
TOMPKINSVILLE SI,"ARTHUR, LILI, HANNA, EDNA, DOLLY, BOB, DIANA, CINDY, DANIELLE, OPHELIA, BERTHA, ANNA, HOW, DANNY, IRENE, EDOUARD, IONE, KYLE, JOSEPHINE, GUSTAV, FLOYD, ELSA, HEIDI, BONNIE, GERDA, ALBERTO, ALMA, CHARLEY, ISAIAS, DOG, BARBARA, ALEX, DONNA, DORIA, ABLE, NOT_NAMED, AGNES, CARRIE, DEAN, DORIAN, BELLE, DAISY, GASTON, GLORIA, SANDY, ISABEL, CLAUDETTE, BERYL, CONNIE, EARL, HELENE, GLADYS, ARLENE, BRET, JOSE, CRISTOBAL, CAROL, EMILY, ODETTE, DIANE, MARIA, CAMILLE, ESTHER, BRENDA, ANDREW, DAVID, DENNIS, DAWN, FELIX, HERMINE, HENRI, FAY",0.5474
TRENTON,"EARL, DORIA, MARIA, CAMILLE, BRET, HERMINE, HANNA, DOLLY, BOB, CLEO, HEIDI, ANNA, HENRI, BERTHA, KYLE, IONE, EDNA, GLORIA, JOSEPHINE, NOT_NAMED, CHARLEY, GASTON, DOG, DONNA, IRENE, GUSTAV, ARLENE, ABLE, CONNIE, BELLE, EMILY, BRENDA, CINDY, DANNY, DAVID, ESTHER, ELSA, CLAUDETTE, OPHELIA, FAY, BERYL, DEAN, DENNIS, CARRIE, ARTHUR, JOSE, DORIAN, FLOYD, AGNES, DAWN, ALEX, DIANA, BONNIE, CAROL, ISAIAS, ODETTE, GLADYS, GABRIELLE, CRISTOBAL, FELIX, DANIELLE, DAISY, ISABEL, DIANE, HELENE, GERDA, BARBARA, HOW, SANDY, EDOUARD, ALMA, ANDREW",0.5324
TROY,"GERDA, DIANE, CONNIE, ARTHUR, DAISY, GLORIA, ISAIAS, FAY, HELENE, BERTHA, BERYL, GASTON, ESTHER, CINDY, DANIELLE, DORIA, HANNA, EDOUARD, ALMA, HENRI, CARRIE, FLOYD, BARBARA, EDNA, NOT_NAMED, HEIDI, EARL, BELLE, CAROL, ELSA, SANDY, BRENDA, IRENE, AGNES, CHARLEY, ALBERTO, DANNY, HERMINE, DAVID, OPHELIA, ABLE, DONNA, BOB",0.4690
VINALHAVEN,"FLOYD, HENRI, DOLLY, DONNA, BERTHA, GINNY, CAROL, EDOUARD, EARL, BRENDA, CINDY, GUSTAV, GASTON, BELLE, ARLENE, GLADYS, DANNY, GLORIA, OPHELIA, ARTHUR, EDNA, GERDA, DIANE, BLANCHE, HEIDI, BETH, BONNIE, KAREN, BERYL, DIANA, CRISTOBAL, BOB, BETSY, KYLE, HERMINE, ALBERTO, BARBARA, CARRIE, ABLE, LILI, ELSA, BILL, ANA, CHARLEY, IRENE, CLEO, JOSE, ESTHER, HELENE, HORTENSE, TEDDY, DORIAN, DAISY, ANNA, DORIA, NOT_NAMED, JUAN, ALMA, ANDREW",0.6347
VINEYARD HAVEN,"DONNA, DOLLY, BOB, HORTENSE, ANDREW, ODETTE, HENRI, EMILY, HOW, CARRIE, DAVID, EARL, DANIELLE, FELIX, ARLENE, ABLE, DIANA, NOT_NAMED, BELLE, KATIA, KYLE, SANDY, GUSTAV, CRISTOBAL, GINNY, CINDY, ARTHUR, GASTON, BETH, HELENE, AGNES, CHARLEY, CLAUDETTE, EDNA, JOSE, DANNY, BARRY, CLEO, IRENE, LILI, ELSA, ISAIAS, BETSY, EDOUARD, DIANE, BECKY, HEIDI, ANNA, HERMINE, BILL, FRANKLIN, BERTHA, FAY, ALMA, DORIAN, MELISSA, DORIA, FLOYD, GLORIA, BLANCHE, HANNA, BRENDA, BONNIE, ALEX, BARBARA, IONE, OPHELIA, KAREN, DAISY, FRANCES, ANA, ALBERTO, GLADYS, ESTHER, GERDA, DENNIS, CAROL, BERYL, DOG",0.6768
WARWICK,"GLORIA, DONNA, HANNA, HERMINE, DORIA, DEAN, KATE, ISAIAS, CAMILLE, CAROL, IRENE, DAISY, DIANA, AGNES, GASTON, ARLENE, HALLIE, FRAN, GABRIELLE, MICHAEL, ANA, ABLE, BELLE, AMY, ANNA, BRET, ISBELL, GLADYS, OPHELIA, EMILY, CLEO, ISABEL, ISIDORE, HAZEL, DORIAN, CONNIE, CLAUDETTE, SANDY, BERYL, DAVID, GINGER, OMAR, DANNY, ESTHER, FLORENCE, CHARLEY, FLOYD, ARTHUR, BARBARA, FREDERIC, ALMA, ALEX, GERDA, DIANE, FAY, IAN, HENRI, DENNIS, IONE, KYLE, NOT_NAMED, EDNA, FELIX, DOLLY, BERTHA, MARIA, ANDREW, ELSA, CRISTOBAL, HUGO, EARL, GUSTAV, HOW, GINNY, ERNESTO, BONNIE, BOB, CINDY, HELENE, MATTHEW, DAWN, GORDON, COLIN, ODETTE, BRENDA, JOSEPHINE, DANIELLE, GRACIE",0.5811
WASHINGTON,"MATTHEW, ABLE, HELENE, FELIX, DORA, ANA, BERTHA, ERIN, NOT_NAMED, CLEO, BETSY, DORIA, DIANA, ANNA, BARBARA, DENNIS, BONNIE, ANDREA, EARL, SANDY, BLANCHE, GRACIE, COLIN, DAVID, IAN, DEAN, JOSE, GORDON, BRET, HUGO, BETH, KATE, ELSA, CLAUDETTE, GERDA, BELLE, GLORIA, LILI, MICHAEL, CAROL, FAY, DORIAN, OPHELIA, HERMINE, ISAIAS, JULIA, CHRIS, HALLIE, DIANE, KYLE, ESTHER, IONE, AGNES, BOB, DONNA, ALMA, HENRI, DANIELLE, DOLLY, CLARA, CHARLEY, GINGER, DAISY, GABRIELLE, ETA, CINDY, BERYL, EMILY, OMAR, IRENE, CONNIE, EDNA, GUSTAV, ERNESTO, FRAN, FLORENCE, ARTHUR, HANNA, BECKY, ALEX, GLADYS, ISIDORE, MARIA, ANDREW, CRISTOBAL, AMY, ALBERTO, DAWN, BILL, BRENDA, ISBELL, HAZEL, DOTTIE, GASTON, ARLENE, DANNY, GINNY, ISABEL, KARA, FLOYD, ODETTE, CAMILLE, DOG, JOSEPHINE, HOW",0.6470
WASHINGTON D.C.,"ARLENE, CLEO, FREDERIC, DAVID, GLORIA, CLAUDETTE, KYLE, GUSTAV, SANDY, ALEX, GINGER, FELIX, CAMILLE, CRISTOBAL, HANNA, BERYL, DAISY, ARTHUR, FAY, DIANE, HERMINE, HENRI, EARL, GERDA, HELENE, DANIELLE, ELSA, BRET, BELLE, HUGO, ISABEL, BONNIE, BARBARA, HALLIE, FLOYD, NOT_NAMED, ISAIAS, DORIAN, FRAN, DENNIS, BERTHA, CAROL, CHARLEY, ESTHER, MICHAEL, ALMA, MATTHEW, CONNIE, GASTON, DONNA, DANNY, DIANA, DEAN, BOB, EMILY, KATE, ANDREW, CINDY, GLADYS, ABLE, OPHELIA, AGNES, DAWN, ANNA, ISBELL, IRENE, MARIA, DORIA, ERNESTO, BRENDA, GABRIELLE, EDNA, HOW, IONE",0.4931
WEEHAWKEN,"DANNY, EDNA, ARLENE, CAMILLE, FELIX, ODETTE, BRENDA, GLORIA, BOB, DORIAN, AGNES, EDOUARD, HOW, DIANA, IRENE, GERDA, LILI, DEAN, JOSEPHINE, CINDY, SANDY, BONNIE, HENRI, DOLLY, CARRIE, DIANE, HERMINE, DAWN, ALBERTO, EARL, MARIA, ALMA, OPHELIA, ABLE, DAVID, CLAUDETTE, BRET, FLOYD, NOT_NAMED, ISAIAS, ARTHUR, EMILY, HEIDI, DOG, CHARLEY, DAISY, BARBARA, DONNA, ANDREW, BERTHA, ALEX, CAROL, HELENE, FAY, ELSA, KYLE, CONNIE, BERYL, JOSE, GLADYS, HANNA, CRISTOBAL, DANIELLE, IONE, GASTON, ISABEL, ANNA, BELLE, DORIA, ESTHER, GUSTAV",0.5392
WEST POINT,"HANNA, KYLE, ABLE, GERDA, EARL, ARLENE, MATTHEW, CHARLEY, HOW, DIANE, DENNIS, ISBELL, BARBARA, GASTON, GUSTAV, ISIDORE, HALLIE, DIANA, BELLE, GABRIELLE, GLADYS, OMAR, GORDON, DOLLY, GINNY, IRENE, FLOYD, CLAUDETTE, DONNA, ODETTE, CAROL, DANIELLE, EMILY, GLORIA, CRISTOBAL, BILL, MICHAEL, ANDREW, IONE, ESTHER, AMY, BOB, EDNA, LILI, DORIA, SANDY, OPHELIA, ISAIAS, GINGER, NOT_NAMED, ALMA, FRAN, DORIAN, ERNESTO, MARIA, BONNIE, ARTHUR, FLORENCE, FAY, BERTHA, ANA, FREDERIC, HENRI, ANNA, KATE, JOSEPHINE, BERYL, CAMILLE, HERMINE, GRACIE, DAWN, AGNES, BRENDA, BRET, CLEO, HUGO, ALEX, FELIX, HELENE, DEAN, DAISY, DOG, JOSE, HAZEL, CINDY, DAVID, DANNY, ISABEL, CONNIE, ELSA, CARRIE",0.6029
WILMINGTON,"DAWN, ALEX, KATE, HANNA, IAN, CHRIS, MARIA, LESLIE, OPHELIA, CONNIE, BONNIE, AGNES, EMILY, FLOYD, BERYL, HENRI, GINNY, GRACIE, ESTHER, DIANA, JOSE, ALMA, DAVID, GERDA, BLANCHE, DEAN, BARBARA, ABLE, ODETTE, CINDY, DAISY, BRENDA, AMY, SANDY, DANIELLE, ANDREA, JIG, FLORENCE, KEITH, HALLIE, HERMINE, BOB, IONE, BRET, CHARLEY, WILMA, ANDREW, DORIAN, CRISTOBAL, KYLE, FREDERIC, ANA, IRENE, BILL, ISABEL, GASTON, DOLLY, ARLENE, GORDON, DIANE, ALBERTO, ETA, EARL, HELENE, DORA, HOW, CLAUDETTE, EDNA, COLIN, CAROL, DOTTIE, NOT_NAMED, FRAN, CLEO, BETSY, JOSEPHINE, DENNIS, DOG, GABRIELLE, MICHAEL, DANNY, CARRIE, ABBY, FAY, ERNESTO, OMAR, MATTHEW, HUGO, ISAIAS, ERIN, BELLE, BERTHA, DONNA, GINGER, ISIDORE, ELSA, ISBELL, ELLA, KARA, HAZEL, GLADYS, BECKY, EDOUARD, GUSTAV, ARTHUR, DORIA, HUMBERTO, GLORIA, ANNA, JULIA, FELIX, CAMILLE",0.6195
WINTER HARBOR,"NOT_NAMED, TEDDY, CLEO, EARL, ELSA, GLADYS, DIANA, BETSY, GINNY, BILL, BOB, DIANE, HERMINE, DORIA, OPHELIA, BETH, JUAN, HELENE, ESTHER, IRENE, BELLE, DONNA, ARLENE, HEIDI, ANA, KAREN, HORTENSE, BARBARA, KYLE, ANNA, BONNIE, ARTHUR, BARRY, ALBERTO, EDNA, EDOUARD, GASTON, GUSTAV, GERDA, DANNY, CAROL, FLOYD, CINDY, LILI, CHARLEY, BERTHA, HENRI, DOLLY, ABLE, CRISTOBAL, BERYL, ALMA, CARRIE, GLORIA, BLANCHE, DORIAN, BRENDA",0.6289
